70221570,Movie,"Power Rangers Samurai: Christmas Together, Friends Forever (Christmas Special)",,"Alex Heartman, Erika Fong, Hector David Jr., Najee De-Tiege, Brittany Anne Pirtle, Steven Skyler, Rene Naufahu, Felix Ryan, Paul Schrier",United States,"January 1, 2016",2011,TV-Y7-FV,24 min,Movies,"On Christmas Eve, as the teens at Shiba House reflect on their first year together, they get an unexpected lesson on the true spirit of the holidays."
70221571,Movie,Power Rangers Samurai: Clash of the Red Rangers,,"Alex Heartman, Erika Fong, Hector David Jr., Najee De-Tiege, Brittany Anne Pirtle, Rene Naufahu",United States,"January 1, 2016",2011,TV-Y7-FV,46 min,Children & Family Movies,The Samurai Rangers team up with the RPM Ranger Red to fight off Master Xandred's Mooger army and a robotic villain from the RPM Ranger's dimension.
70221569,Movie,Power Rangers Samurai: Party Monsters (Halloween Special),,"Alex Heartman, Erika Fong, Hector David Jr., Najee De-Tiege, Brittany Anne Pirtle, Steven Skyler, Rene Naufahu, Felix Ryan, Paul Schrier, Ricardo Medina Jr.",United States,"January 1, 2016",2011,TV-Y7-FV,24 min,Movies,"On Halloween night, the creepiest creatures from the Netherworld trade war stories about their battles with the Samurai Power Rangers."
80008257,TV Show,Power Rangers Super Megaforce,,"Andrew M. Gray, Ciara Hanna, John Mark Loudermilk, Christina Masterson, Azim Rizk, Geoff Dolan, Shailesh Prajapati, Ian Harcourt, Estevez Gillespie, Jason Hood",United States,"January 1, 2016",2014,TV-Y7,1 Season,Kids' TV,"Armed with a key that allows them to morph into any team of Legendary Rangers from the past, the Super Megaforce Rangers fight ruthless Prince Vekar."
80092837,Movie,Power Rangers Super Megaforce: The Legendary Battle (Extended),"Charlie Haskell, Koichi Sakamoto","Andrew M. Gray, Ciara Hanna, John Mark Loudermilk, Christina Masterson, Azim Rizk, Cameron Jebo, Shailesh Prajapati, Ian Harcourt",United States,"January 1, 2016",2014,TV-Y7,55 min,Movies,"New footage augments the tale of the Rangers, who give their all to save Earth from Vrak and Emperor Mavro, as the Armada stages an epic final attack."
70259568,TV Show,Power Rangers Super Samurai,,"Alex Heartman, Erika Fong, Hector David Jr., Najee De-Tiege, Brittany Anne Pirtle, Steven Skyler, Rene Naufahu, Felix Ryan, Paul Schrier, Jeff Szusterman, Kate Elliott, Ricardo Medina Jr., Derek Judge, Stig Alred",United States,"January 1, 2016",2012,TV-Y7-FV,1 Season,Kids' TV,"The Samurai Power Rangers continue their battle against the evil Master Xandred, who has now joined forces with the malevolent Serrator."
70242898,Movie,Power Rangers Super Samurai: Stuck on Christmas,,"Alex Heartman, Najee De-Tiege, Hector David Jr., Erika Fong, Brittany Anne Pirtle, Steven Skyler, Paul Schrier, Felix Ryan, Jeff Szusterman, Stig Alred, Kate Elliot",United States,"January 1, 2016",2012,TV-Y7-FV,24 min,"Children & Family Movies, Sci-Fi & Fantasy",The Samurai Rangers get stuck in the Megazord's cockpit on Christmas Eve when it breaks down. Can the Rangers get out in time for Christmas?
70242897,Movie,Power Rangers Super Samurai: Trickster Treat,,"Alex Heartman, Najee De-Tiege, Hector David Jr., Erika Fong, Brittany Anne Pirtle, Steven Skyler, Rene Naufahu, Paul Schrier, Felix Ryan, Jeff Szusterman, Stig Alred, Kate Elliot",United States,"January 1, 2016",2012,TV-Y7-FV,23 min,Movies,"When a Nighlok invades the Samurai Rangers' dreams and turns them into nightmares, the Rangers must figure out what is reality and what is illusion."
70213075,TV Show,Power Rangers Time Force,,"Jason Faunt, Erin Cahill, Kevin Kleinberg, Deborah Estelle Phillips, Michael Copon, Daniel Southworth, Vernon Wells, Kate Sheldon, Edward Lawrence Albert, Brianne Siddall, Terence J. Rotolo, Eddie Frierson",United States,"January 1, 2016",2001,TV-Y7-FV,1 Season,Kids' TV,"The team launches a new campaign against evil in the year 3000, when the imprisoned criminal mastermind Ransik is freed by his daughter."
70213074,TV Show,Power Rangers Turbo,,"Johnny Yong Bosch, Nakia Burrise, Blake Foster, Jason David Frank, Catherine Sutherland, Carol Hoyt, Jason Narvy, Paul Schrier, Gregg Bullock, Hilary Shepard, Tracy Lynn Cruz, Patricia Ja Lee, Roger Velasco, Selwyn Ward, Donene Kistler","United States, France, Japan","January 1, 2016",1997,TV-Y7-FV,1 Season,Kids' TV,"The Rangers use high-tech battle cars to take on Queen Divatox and her Divazords, who mount an attack on the Rangers' beloved Angel Grove."
70213073,TV Show,Power Rangers Wild Force,,"Ricardo Medina Jr., Alyson Kiperman, Phillip Jeanmarie, Jessica Rey, Jack Guzman, Phillip Andrew, Ann Marie Crouch, Ilia Volok, Sin Wong, Danny Wayne, Terence J. Rotolo","United States, Netherlands, Japan, France","January 1, 2016",2002,TV-Y7-FV,1 Season,Kids' TV,"Raised in the wilderness, young Cole Evans leads the Wild Force Power Rangers as they summon their animal powers to battle the evil Master Org."
70213072,TV Show,Power Rangers Zeo,,"Catherine Sutherland, Nakia Burrise, Steve Cardenas, Johnny Yong Bosch, Jason David Frank, David Yost, Austin St. John, Paul Schrier, Jason Narvy, Namihei Koshige, Danny Wayne, Akira Madden, David Stenstrom, Tadahiro Nakamura, Kerrigan Mahan","United States, France, Japan","January 1, 2016",1996,TV-Y7-FV,1 Season,Kids' TV,"This ""Mighty Morphin Power Rangers"" spinoff finds Tommy and the gang battling new enemies, using abilities acquired from the Zeo Crystal."
70294113,TV Show,Power Rangers: Megaforce,,"Andrew M. Gray, Ciara Hanna, John Mark Loudermilk, Christina Masterson, Azim Rizk, Shailesh Prajapati, Ian Harcourt",United States,"January 1, 2016",2013,TV-Y7-FV,1 Season,Kids' TV,"When Earth is threatened by a massive alien invasion, the planet's supernatural guardian calls upon five teenagers to form the ultimate defense team."
70242900,Movie,Power Rangers: Megaforce: Raising Spirits,,"Andrew M. Gray, John Mark Loudermilk, Ciara Hanna, Azim Rizk, Christina Masterson, Shailesh Prajapati, Ian Harcourt",United States,"January 1, 2016",2013,TV-Y7-FV,24 min,Children & Family Movies,"On Halloween, the scariest night of the year, the Rangers have a strange encounter with a mysterious medium who conjures ""visions"" of monsters past."
70242899,Movie,Power Rangers: Megaforce: The Robo Knight Before Christmas,James Barr,"Andrew M. Gray, Ciara Hanna, John Mark Loudermilk, Christina Masterson, Azim Rizk, Shailesh Prajapati, Ian Harcourt",United States,"January 1, 2016",2013,TV-Y7-FV,24 min,Children & Family Movies,Robo Knight learns the meaning of Christmas from a group of children when he is mistaken for a donated Christmas toy and is shipped to a foreign land.
70287605,TV Show,Strawberry Shortcake: Berry Bitty Adventures,,"Anna Cummer, Janyse Jaud, Andrea Libman, Britt McKillip, Ingrid Nilson, Ashleigh Ball","France, United States, Canada","January 1, 2016",2015,TV-Y,1 Season,Kids' TV,"Join Strawberry Shortcake and her berry best friends in the whimsical land of Berry Bitty City, where they learn about teamwork and decision-making."
70053412,Movie,To and From New York,Sorin Dan Mihalcescu,"Barbara King, Shaana Diya, John Krisiukenas, Yoriko Haraguchi, David Crane, Chad Thomas",United States,"January 1, 2008",2006,NR,81 min,"Dramas, Independent Movies, Thrillers","While covering a story in New York City, a Seattle-based reporter uncovers a link between two missing women that changes her article entirely."
80131616,Movie,God Bless the Broken Road,Harold Cronk,"Patrika Darbo, Kim Delaney, Jordin Sparks, Makenzie Moss, Liam Matthews, Andrew W. Walker, Lindsay Pulsipher, Gary Grubbs, Robin Givens, Arthur Cartwright",United States,"February 9, 2019",2018,PG,111 min,"Children & Family Movies, Dramas, Faith & Spirituality","After a young mother is widowed by war, her faith is tested as she struggles to stay afloat financially and raise her daughter."
81020653,TV Show,Iron Ladies,,"Aviis Zhong, Ben Wu, Ada Pan, Jacqueline Zhu, Gabriel Lan, Jack Lee, Wu Ting-chien, Wills Sia, Su Yen-ti, Jenny Huang",Taiwan,"February 9, 2019",2018,TV-14,1 Season,"International TV Shows, Romantic TV Shows, TV Dramas",Three 30-something women in high-level jobs at a beauty e-commerce firm seem to have it all – except when it comes to love and romantic chemistry.
80174367,Movie,Seeing Allred,"Roberta Grossman, Sophie Sartain",Gloria Allred,United States,"February 9, 2018",2018,TV-14,96 min,Documentaries,"Explore the public and private sides of feminist firebrand attorney Gloria Allred, who's battled some of the biggest names in politics and business."
80217312,Movie,The Ritual,David Bruckner,"Rafe Spall, Arsher Ali, Robert James-Collier, Sam Troughton","United Kingdom, Canada","February 9, 2018",2018,TV-MA,95 min,"Horror Movies, International Movies, Thrillers","Four friends with a long-standing – but strained – connection take a hiking trip into the Swedish wilderness, from which they may never return."
80209006,Movie,The Trader (Sovdagari),Tamta Gabrichidze,,Georgia,"February 9, 2018",2018,TV-PG,24 min,"Documentaries, International Movies","A traveling trader provides a window into rural life in the Republic of Georgia, where potatoes are currency and ambition is crushed by poverty."
80220692,TV Show,Tientsin Mystic,,"Li Xian, Zhang Ming En, Wang Zixuan, Chen Yumi, Tang Yinuo, Wei Qing, Yang Shuming, Chen Jian, Kang Enhe, Dong Xiangrong",China,"February 9, 2018",2017,TV-14,1 Season,"Crime TV Shows, International TV Shows, TV Dramas","In an otherworldly river town, a policeman follows the trail of a sinister force to save his community from deadly spells."
80117531,Movie,When We First Met,Ari Sandel,"Adam DeVine, Alexandra Daddario, Shelley Hennig, Robbie Amell, Andrew Bachelor",United States,"February 9, 2018",2018,TV-14,97 min,"Comedies, Romantic Movies","Using a magical photo booth that sends him back in time, Noah relives the night he met Avery over and over, trying to persuade her to fall for him."
80153131,Movie,Don't Knock Twice,Caradog W. James,"Katee Sackhoff, Lucy Boynton, Richard Mylan, Nick Moran, Pascale Wilson, Javier Botet, Pooneh Hajimohammadi, Sarah Buckland",United Kingdom,"February 8, 2019",2016,R,93 min,"Horror Movies, International Movies",A recovering addict becomes her estranged daughter's only hope after the teen awakens a terrifying child-stealing witch from an urban legend.
80991400,Movie,High Flying Bird,Steven Soderbergh,"André Holland, Zazie Beetz, Bill Duke, Kyle MacLachlan, Melvin Gregg, Sonja Sohn, Zachary Quinto",United States,"February 8, 2019",2019,TV-MA,91 min,"Dramas, Sports Movies","When an NBA lockout sidelines his big rookie client, an agent hatches a bold plan to save their careers – and disrupt the league's power structure."
81059388,Movie,Incredibles 2 (Spanish Version),Brad Bird,"Víctor Trujillo, Consuelo Duval, Darío T. Pie, Leyla Rangel, Oliver Díaz Barba, Dulce Guerrero, Eli Fucile, Martin Hernandez",United States,"February 8, 2019",2018,PG,118 min,"Children & Family Movies, Comedies","When Elastigirl gets recruited for a high-profile crime-fighting mission, Mr. Incredible takes on his toughest assignment ever: full-time parenting."
80231156,Movie,Kevin Hart's Guide to Black History,Tom Stern,"Kevin Hart, Saniyya Sidney, Lil Rel Howery, Eoghan Thomas Murphy, Tiffany Haddish, Al Shearer, Lonnie Chavis, Alphonso Mcauley, Nika Williams, Barry Brewer, Greg Germann, John Ennis, Jay Johnston",United States,"February 8, 2019",2019,TV-PG,63 min,"Children & Family Movies, Comedies",Kevin Hart highlights the fascinating contributions of black history’s unsung heroes in this entertaining – and educational – comedy special.
81002145,TV Show,Nailed It! Mexico,,"Omar Chaparro, Anna Ruiz","United States, Mexico","February 8, 2019",2019,TV-PG,1 Season,"International TV Shows, Reality TV, Spanish-Language TV Shows","The fun, fondant and hilarious cake fails head to Mexico, where very amateur bakers compete to re-create elaborate sweet treats for a cash prize."
80191045,Movie,ReMastered: The Two Killings of Sam Cooke,Kelly Duane de la Vega,Sam Cooke,United States,"February 8, 2019",2019,TV-MA,74 min,"Documentaries, Music & Musicals","While Sam Cooke rose to stardom as a soul singer, his outspoken views on civil rights drew attention that may have contributed to his death at age 33."
81029383,Movie,The Tree of Blood,Julio Medem,"Úrsula Corberó, Álvaro Cervantes, Najwa Nimri, Patricia López Arnaiz, Daniel Grao, Joaquín Furriel, Maria Molins, Emilio Gutiérrez Caba, Luisa Gavasa, José María Pou, Ángela Molina",Spain,"February 8, 2019",2018,TV-MA,136 min,"Dramas, Independent Movies, International Movies","As a young couple write the story of their families' shared history, both reveal their relatives' dark secrets and one must make a painful confession."
80241001,TV Show,Unauthorized Living,,"José Coronado, Álex González, Claudia Traisac, Luís Zahera, Pilar Castro, Àlex Monner, Giulia Charm, Unax Ugalde, Ricardo Gómez, Ledicia Sola, Leonor Watling, Patrick Criado, Xabier Deive, Camila Bossa, María Guinea, Édgar Vittorino, Javier Abad, Daniel Currás, Mercedes Castro, Paula Morado, Paula Pier, Carmela Martins, Denis Gómez, Miguel Borines, Ana Villagrasa, Xavier Estévez, Carlos Hipólito",Spain,"February 8, 2019",2018,TV-MA,1 Season,"Crime TV Shows, International TV Shows, Spanish-Language TV Shows","When a Galician shipper and drug lord hiding his Alzheimer's disease plans to retire, his second-in-command plots to steal the empire from the heir."
80178280,Movie,6 Days,Toa Fraser,"Jamie Bell, Abbie Cornish, Mark Strong, Martin Shaw, Ben Turner, Aymen Hamdouchi, Tim Pigott-Smith, Robert Portal, Colin Garlick, Andrew Grainger, Martin Hancock, Emun Elliott","New Zealand, United Kingdom","February 8, 2018",2017,R,94 min,"Action & Adventure, Dramas, International Movies","When armed gunmen seize the Iranian Embassy in 1980, a tense six-day standoff ensues while elite British soldiers prepare for a dangerous raid."
80119555,Movie,Blinky Bill: The Movie,Deane Taylor,"Ryan Kwanten, Rufus Sewell, Toni Collette, Robin McLeavy, David Wenham, Barry Humphries, Richard Roxburgh, Deborah Mailman, Barry Otto","Australia, United States","February 8, 2017",2015,PG,91 min,Children & Family Movies,Happy koala Blinky Bill and some spunky pals travel the Outback following clues to help him find his long-lost father and finally bring him home.
80158270,Movie,Happy Times,Luis Javier M. Henaine,"Luis Arrieta, Cassandra Ciangherotti, Humberto Busto, Iván Arana, Bárbara de Regil, Miguel Rodarte",Mexico,"February 8, 2017",2014,NR,79 min,"Comedies, International Movies, Romantic Movies","Desperate to break up with his clingy girlfriend, a nerdy cartoonist hires a mysterious agency to do the deed. But the agency has unusual methods."
70302836,Movie,Jack and the Cuckoo-Clock Heart,"Mathias Malzieu, Stéphane Berla","Orlando Seale, Samantha Barks, Harry Sadeghi, Stephane Cornicard, Jessie Buckley, Sophia Ellis, Barbara Scaff, Michelle Fairley, Richard Ridings, Howard Samuels","France, Belgium","February 8, 2017",2013,PG,93 min,"Children & Family Movies, Music & Musicals","Equipped with a mechanical heart and determined to stay out of death's shadow, young Jack understands that love could prove fatal."
70212989,TV Show,The Pyramid Code,,Sally Jennings,Canada,"February 8, 2016",2009,TV-PG,1 Season,"Docuseries, Science & Nature TV",How was the scientific understanding of the ancients so advanced? A team of experts answers this and other questions in this fascinating series.
81034763,Movie,Lez Bomb,Jenna Laurenzo,"Jenna Laurenzo, Deirdre O'Connell, Brandon Michael Hall, Kevin Pollak, Elaine Hendrix, Steve Guttenberg, Cloris Leachman, Bruce Dern",United States,"February 7, 2019",2018,TV-14,90 min,"Comedies, LGBTQ Movies",A young woman's attempt to come out of the closet on Thanksgiving gets complicated when her male roommate shows up to her parents' home unannounced.
81044300,TV Show,The Last of the Schmucks,,"Chico, Ahmed Mekky, Hesham Maged, Bayoumi Fouad, Dina El-Sherbiny",Egypt,"February 7, 2019",2017,TV-MA,1 Season,"International TV Shows, TV Comedies","The year is 2041 and a dispute between a man and his wife has set the human race back. In this battle of the sexes, the primitive life isn't so simple."
80151370,Movie,"Michael Bolton's Big, Sexy Valentine's Day Special","Scott Aukerman, Akiva Schaffer","Michael Bolton, Andy Samberg, Will Forte, Kenny G, Maya Rudolph, Adam Scott, Janeane Garofalo, Brooke Shields, Sinbad, Michael Sheen, Tim Robinson, Bob Saget, Mary Holland, Andy Richter, Colton Dunn, David Theune, Randall Park, Sarah Silverman, Mary Sohn, Fred Armisen, Matthew Kimbrough, Maya Erskine, Louie Anderson, Claudia O'Doherty, Kate Berlant, Baron Vaughn, Zachary Oyama, Casey Wilson, Sarah Shahi, Jimmy Graham, Luka Jones, Akiva Schaffer, Eric André, Scott Aukerman, Nicole Byer, Dave Ferguson, Tim Kalpakis, Mike Hanford, Mircea Monroe, Chris Parnell, Sal Stowers",United States,"February 7, 2017",2017,TV-MA,54 min,"Comedies, Music & Musicals, Romantic Movies","After Santa tells him he needs 75,000 new babies by Christmas to meet toy supply, Michael Bolton hosts a telethon to inspire the world to make love."
81010962,Movie,Di Renjie zhi Sidatianwang,Hark Tsui,"Mark Chao, Feng Shaofeng, Kenny Lin, Carina Lau, Ethan Juan, Sandra Ma","China, Hong Kong","February 6, 2019",2018,TV-MA,132 min,"Action & Adventure, International Movies, Sci-Fi & Fantasy","Framed by an empress who plans to steal a dragon-taming mace, imperial magistrate Dee Renjie soon uncovers a greater plot that threatens the kingdom."
80094258,Movie,The Confirmation,Bob Nelson,"Clive Owen, Maria Bello, Patton Oswalt, Jaeden Lieberher, Matthew Modine, Stephen Tobolowsky, Tim Blake Nelson, Robert Forster",Canada,"February 6, 2019",2016,PG-13,101 min,"Comedies, Dramas, Independent Movies",A divorced handyman with a drinking problem bonds with his 8-year-old son when a search for his stolen toolbox leads to a series of misadventures.
80159028,Movie,Fred Armisen: Standup For Drummers,Lance Bangs,Fred Armisen,,"February 6, 2018",2018,TV-PG,65 min,"Music & Musicals, Stand-Up Comedy","For an audience of drummers, comedian Fred Armisen shares and demonstrates his thoughts on musical genres, drummer quirks, regional accents and more."
80179371,TV Show,Valor,,"Christina Ochoa, Matt Barr, Corbin Reid, Charlie Barnett, W. Tré Davis",United States,"February 6, 2018",2018,NR,1 Season,"TV Action & Adventure, TV Dramas","Following an unsuccessful mission in Somalia, the two surviving members of a U.S. Army helicopter crew are embroiled in an unseemly conspiracy."
80201570,Movie,Welcome to Willits,Trevor Ryan,"Bill Sage, Sabina Gadecki, Anastasia Baranova, Dolph Lundgren, Thomas Dekker, Karrueche Tran, Chris Zylka, Keelin Woodell, Garrett Clayton, Shad Gaspard, Rory Culkin",United States,"February 6, 2018",2017,TV-MA,84 min,"Comedies, Horror Movies, Independent Movies",A marijuana farmer's extraterrestrial paranoia creates trouble for a group of young campers who pitch their tent on his land in Northern California.
80225034,Movie,Woody Woodpecker,Alex Zamm,"Timothy Omundson, Thaila Ayala, Eric Bauza, Graham Verchere, Jordana Largy, Scott McNeil, Adrian Glynn McMorran, Chelsea Miller, Sean Tyson",United States,"February 6, 2018",2017,PG,91 min,"Children & Family Movies, Comedies",A rascally bird with a distinctive laugh pecks back with a vengeance when his forest habitat is threatened by a slick lawyer building his dream home.
80044834,Movie,Lila & Eve,Charles Stone III,"Viola Davis, Jennifer Lopez, Andre Royo, Shea Whigham, Aml Ameen, Chris Chalk, Will Brittain, Michole Briana White, Julius Tennon, Gino Vento, Yolonda Ross",United States,"February 6, 2016",2015,R,94 min,"Dramas, Thrillers","After each of them loses a child to murder, two women who meet in a support group initiate their own investigation when the police are no help."
81049811,TV Show,Hidden Worlds,,"Adel Imam, Salah Abdallah, Hiba Majdi, Bushra, Fathy Abdel Wehab, Rania Farid Shawki, Ahmad Wafiq",Egypt,"February 5, 2019",2018,TV-14,1 Season,"Crime TV Shows, International TV Shows, TV Dramas","While investigating an actress’s supposed suicide and her connection to the mafia, a veteran journalist discovers that corruption runs deep."
80214523,TV Show,Live,,"Jung Yu-mi, Lee Kwang-soo, Bae Seong-woo, Bae Jong-ok, Sung Dong-il",South Korea,"February 5, 2019",2018,TV-MA,1 Season,"Crime TV Shows, International TV Shows, Korean TV Shows",The police officers at South Korea's busiest patrol division toil day and night as keepers of law and peace – but the reality is far from orderly.
80216779,Movie,"Ray Romano: Right Here, Around the Corner",Michael Showalter,Ray Romano,United States,"February 5, 2019",2019,TV-MA,59 min,Stand-Up Comedy,"Ray Romano cut his stand-up teeth at the Comedy Cellar in New York. Now, in his first comedy special in 23 years, he returns to where it all began."
80201500,TV Show,Safe,,"Michael C. Hall, Amanda Abbington, Marc Warren, Hannah Arterton, Audrey Fleurot, Nigel Lindsay",United Kingdom,"February 5, 2019",2018,TV-MA,1 Season,"British TV Shows, Crime TV Shows, International TV Shows","After his teenage daughter goes missing, a widowed surgeon in an affluent neighborhood begins unearthing dark secrets about the people closest to him."
81049774,TV Show,Tayee,,"Amr Youssef, Amr Abdel Guelil, Saba Mubarak",Egypt,"February 5, 2019",2018,TV-MA,1 Season,"International TV Shows, TV Dramas",An Egyptian doctor becomes a police informant and uses his rare gift of tracking ancient artifacts in the smuggling business.
80182123,TV Show,Violet Evergarden,,"Yui Ishikawa, Takehito Koyasu, Daisuke Namikawa, Aya Endo, Koki Uchiyama, Minori Chihara, Haruka Tomatsu",Japan,"February 5, 2019",2018,TV-14,1 Season,"Anime Series, International TV Shows, Romantic TV Shows","The war is over, and Violet Evergarden needs a job. Scarred and emotionless, she takes a job as a letter writer to understand herself and her past."
80221279,TV Show,OCTB,,"Jordan Chan, Justin Cheung, Kwok-Kwan Chan, Sam Lee, Alan Kuo, Ken Wong, Samuel Pang, Rose Chan, Hugo Ng, Ng Man-Tat, Chen Yating, Michael Wai-Man Chan, Philip Chan, Ben Ng",Hong Kong,"February 5, 2018",2017,TV-14,1 Season,"Crime TV Shows, International TV Shows, TV Dramas",An undercover detective crosses paths with familiar faces in the mafia underworld during the final years of Britain's ruling of Hong Kong.
80201497,Movie,Princess Cyd,Stephen Cone,"Tyler Ross, Rebecca Spence, James Vincent Meredith",United States,"February 5, 2018",2017,TV-MA,97 min,"Dramas, Independent Movies, LGBTQ Movies",A teenager moves to Chicago for the summer and finds a poignant mentor in her aunt and a sweet love interest in a girl who works in the neighborhood.
80134431,Movie,The Cloverfield Paradox,Julius Onah,"Gugu Mbatha-Raw, David Oyelowo, Daniel Brühl, John Ortiz, Chris O'Dowd, Aksel Hennie, Zhang Ziyi, Elizabeth Debicki, Roger Davies, Clover Nee",United States,"February 5, 2018",2018,TV-MA,102 min,"Action & Adventure, Sci-Fi & Fantasy","Orbiting above a planet on the brink of war, scientists test a device to solve an energy crisis and end up face-to-face with a dark alternate reality."
80198745,Movie,Thumper,Jordan Ross,"Eliza Taylor, Pablo Schreiber, Daniel Webber, Lena Headey, Ben Feldman, Grant Harvey, Jazzy De Lisser, Brett Rice",United States,"February 5, 2018",2017,TV-MA,93 min,"Dramas, Thrillers","After moving to a hardscrabble suburban California town, a young woman becomes dangerously entangled with a local drug enterprise."
80168052,Movie,Naga The Eternal Yogi,"Krishna Agazzi, Filippo Gastaldi",,"Italy, India","February 5, 2017",2016,TV-PG,73 min,"Documentaries, International Movies","This documentary examines the naked yoga gurus of India whose devout spiritual practice connects them to the eternal, transcending the material world."
80167667,Movie,Star Men,Alison E. Rose,,"Canada, United States, United Kingdom","February 5, 2017",2015,TV-14,88 min,Documentaries,Four astronomers from England celebrate 50 years of friendship and achievement by taking a reflective road trip through the American Southwest.
80038446,Movie,The Lovers,Roland Joffé,"Josh Hartnett, Bipasha Basu, Tamsin Egerton, James Mackay, Alice Englert, Simone Kessell, Abhay Deol, Aegina De Vas, Andrea Deck","Belgium, India, Australia","February 5, 2017",2015,R,109 min,"Action & Adventure, Dramas, Independent Movies","A magical ring holds the key to life, death and love for a marine archaeologist who seems to live two lives in different centuries and countries."
80059410,Movie,Hannibal Buress: Comedy Camisado,Lance Bangs,Hannibal Buress,United States,"February 5, 2016",2016,TV-MA,68 min,Stand-Up Comedy,"In a special packed with stealthy humor, Hannibal Buress tackles zipper etiquette, the legacy of steroids and the fallout from his Bill Cosby routine."
70252885,Movie,El último testigo,Philipp Stölzl,"Aaron Eckhart, Liana Liberato, Olga Kurylenko, Garrick Hagon, Eric Godon, Yassine Fadel, Neil Napier, David Bark-Jones, Alexander Fehling, Nick Alachiotis, Jade Hassouné","United States, Canada, Belgium, United Kingdom","February 4, 2018",2012,R,105 min,Action & Adventure,A security expert and ex-CIA agent living in Belgium must go on the run with his estranged teen daughter when they're both marked for assassination.
80157760,Movie,The Charnel House,Craig Moss,"Callum Blue, Nadine Velazquez, Makenzie Moss, Erik LaRay Harvey, Danielle Lauder, Andy Favreau, Kate Linder, Neil Thackaberry, Alden Tab",United States,"February 4, 2017",2016,R,93 min,"Horror Movies, Thrillers","After an architect transforms a slaughterhouse into trendy lofts, its new inhabitants discover that the structure is haunted by its evil past."
