70172485,TV Show,Victorious,,"Victoria Justice, Leon Thomas III, Matt Bennett, Elizabeth Gillies, Ariana Grande, Avan Jogia, Daniella Monet, Michael Eric Reid, Jake Farrow, Eric Lange",United States," November 2, 2019",2013,TV-G,3 Seasons,"Kids' TV, TV Comedies","When aspiring singer Tori Vega joins the eccentric students at Hollywood Arts High, she struggles to fit in with the amazingly talented teens."
70178217,TV Show,House of Cards,,"Kevin Spacey, Robin Wright, Kate Mara, Corey Stoll, Sakina Jaffrey, Kristen Connolly, Constance Zimmer, Sebastian Arcelus, Nathan Darrow, Sandrine Holt, Michel Gill, Elizabeth Norment, Mahershala Ali, Reg E. Cathey, Molly Parker, Derek Cecil, Elizabeth Marvel, Kim Dickens, Lars Mikkelsen, Michael Kelly, Joel Kinnaman, Campbell Scott, Patricia Clarkson, Neve Campbell",United States," November 2, 2018",2018,TV-MA,6 Seasons,"TV Dramas, TV Thrillers","A ruthless politician will stop at nothing to conquer Washington, D.C., in this Emmy and Golden Globe-winning political drama."
80074249,TV Show,The Last Kingdom,,"Alexander Dreymon, Emily Cox, David Dawson, Ian Hart, Rune Temte, Matthew Macfadyen, Rutger Hauer, Tobias Santelmann, Peter Gantzler, Adrian Bower, Joseph Millson, Henning Valin Jakobsen, Alexandre Willaume, Thomas W. Gabrielsson",United Kingdom," November 19, 2018",2018,TV-MA,3 Seasons,"British TV Shows, International TV Shows, TV Action & Adventure","As Alfred the Great defends his kingdom from Norse invaders, Uhtred – born a Saxon but raised by Vikings – seeks to claim his ancestral birthright."
70264616,TV Show,Goosebumps,,R.L. Stine,Canada," November 19, 2014",1998,TV-Y7,5 Seasons,"Kids' TV, TV Thrillers",R.L. Stine's tales take on a life of their own in a series that combines original stories with adaptations drawn from the popular books.
70264612,TV Show,The Magic School Bus,,"Lily Tomlin, Daniel DeSanto, Erica Luttrell, Maia Filar, Lisa Yamanaka, Tara Meyer, Stuart Stone, Malcolm-Jamal Warner, Danny Tamberelli","Canada, United States"," November 19, 2014",1997,TV-Y,4 Seasons,Kids' TV,"Join Ms. Frizzle as the Magic School Bus travels to outer space, under the sea, through an anthill – and even inside the human body!"
80025678,TV Show,The Crown,,"Claire Foy, John Lithgow, Matt Smith, Vanessa Kirby, Jared Harris, Victoria Hamilton, Eileen Atkins, Jeremy Northam, Alex Jennings, Ben Miles, Pip Torrens, Will Keen, Harry Hadden-Paton, Daniel Ings, Greg Wise, Harriet Walter, Lia Williams, Matthew Goode, Anton Lesser","United Kingdom, United States"," November 17, 2019",2019,TV-MA,3 Seasons,"British TV Shows, International TV Shows, TV Dramas",This drama follows the political rivalries and romance of Queen Elizabeth II's reign and the events that shaped the second half of the 20th century.
70269479,TV Show,Longmire,,"Robert Taylor, Katee Sackhoff, Lou Diamond Phillips, Bailey Chase, Cassidy Freeman, Adam Bartley, Louanne Stephens",United States," November 17, 2017",2017,TV-14,6 Seasons,"Crime TV Shows, TV Dramas",This contemporary crime thriller focuses on a Wyoming sheriff who's rebuilding his life and career following the death of his wife.
80057171,TV Show,Luna Petunia,,"Ciara Alexys, Katie Griffin, Cory Doran, Jonah Wineberg",United States," November 17, 2017",2017,TV-Y,3 Seasons,Kids' TV,"With help from her magic toy chest, fun-loving Luna Petunia enters the fantastic land of Amazia, where adventures, friendship and learning await."
80245299,TV Show,Ponysitters Club,,"Morgan Neundorf, Madeline Leon, Khiyla Aynne, Cailan Laine Punnewaert, Zyon Allen, Maya Franzoi, Victoria Tomazelli, Hugh Wilson, Diana Chrisman",Canada," November 16, 2018",2018,TV-Y7,2 Seasons,"Kids' TV, TV Dramas",A young horse enthusiast teams up with her best friends to rescue and rehabilitate animals on her family's beloved ranch.
80003477,TV Show,K-On!,,"Aki Toyosaki, Ayana Taketatsu, Chika Fujito, Madoka Yonezawa, Minako Kotobuki, Satomi Sato, Yoko Hikasa",Japan," November 15, 2019",2010,TV-PG,2 Seasons,"Anime Series, Teen TV Shows","When they're not gorging themselves on sugary snacks, four aspiring high school musicians crank out catchy tunes as members of the Light Music Club."
80115338,TV Show,Llama Llama,,"Jennifer Garner, Shayle Simons, Vania Gill, Islie Hirvonen, Brendon Sunderland, Austin Abell, Evans Johnson, Kathleen Barr, David Hoole",United States," November 15, 2019",2019,TV-Y,2 Seasons,Kids' TV,"Beloved children's book character Llama Llama springs to life in this heartwarming series about family, friendship and learning new things."
80161497,TV Show,The Toys That Made Us,,,United States," November 15, 2019",2019,TV-14,3 Seasons,"Docuseries, Reality TV",The minds behind history's most iconic toy franchises discuss the rise – and sometimes fall – of their billion-dollar creations.
81086462,TV Show,The Yard,,"Demet Evgar, Ceren Moray, Nursel Köse, Kenan Ece, Teoman Kumbaracıbaşı, Çağdaş Onur Öztürk, Deniz Barut, Onuryay Evrentan, Görkem Mertsöz, Mert Tanık, Ayça Damgacı",Turkey," November 15, 2019",2019,TV-MA,2 Seasons,"Crime TV Shows, International TV Shows, TV Dramas","After a fateful domestic clash, a devoted mother finds herself in prison and fighting to survive in hopes of reuniting with her daughter."
81070963,TV Show,Chief of Staff,,"Lee Jung-jae, Shin Mina, Lee Elijah, Kim Dong-jun, Jung Jin-young, Kim Kap-soo, Jung Woong-in, Im Won-hee, Kim Hong-pa",South Korea," November 12, 2019",2019,TV-14,2 Seasons,"International TV Shows, Korean TV Shows, TV Dramas","As a chief of staff in the National Assembly, Jang Tae-jun influences power behind the scenes while pursuing his own ambitions to rise to the top."
70234440,TV Show,My Little Pony: Friendship Is Magic,,"Ashleigh Ball, Tabitha St. Germain, Tara Strong, Andrea Libman, Cathy Weseluck, Nicole Oliver","United States, Canada"," November 12, 2018",2018,TV-Y,8 Seasons,Kids' TV,"Journey to the enchanted land of Equestria, where unicorn Twilight Sparkle and her pals have adventures and learn valuable lessons about friendship."
80239931,TV Show,Patriot Act with Hasan Minhaj,,Hasan Minhaj,," November 10, 2019",2019,TV-MA,5 Seasons,TV Comedies,"Every Sunday, Hasan Minhaj brings an incisive and nuanced perspective to global news, politics and culture in his unique comedy series."
80175619,TV Show,Glitter Force Doki Doki,Go Koga,"Debi Derryberry, Cassandra Morris, Melissa Fahn, Stephanie Sheh, Erica Lindbeck, Kate Higgins, Cherami Leigh, Tara Sands, Bryce Papenbrook, Erica Mendez, Ray Chase, Carrie Keranen, Ben Diskin, Grant George, Kirk Thornton",Japan," November 10, 2017",2017,TV-Y7,2 Seasons,"Anime Series, Kids' TV",Four girls summon their inner superheroes to defend Earth and the magical kingdom of Splendorius from King Mercenare and his minions.
80046193,TV Show,Lady Dynamite,,"Maria Bamford, Fred Melamed, Mary Kay Place, Ed Begley Jr., Ana Gasteyer, Lennon Parham, Bridget Everett, Mo Collins, June Diane Raphael, Dean Cain, Ólafur Darri Ólafsson, Patton Oswalt, Keith Lucas, Kenny Lucas, Sarah Silverman, Mira Sorvino, Jon Cryer, Brandon Routh, Adam Pally, Tig Notaro, Andy Samberg, David Spade, Fred Armisen, Jason Mantzoukas, Jenny Slate, Judd Apatow, Judy Greer, Weird Al Yankovic",United States," November 10, 2017",2017,TV-MA,2 Seasons,TV Comedies,Comedian Maria Bamford stars in a series inspired by her own life. It's the sometimes surreal story of a woman who loses – and then finds – her s**t.
80117540,TV Show,Atypical,,"Jennifer Jason Leigh, Keir Gilchrist, Michael Rapaport, Brigette Lundy-Paine, Amy Okuda, Jenna Boyd, Graham Rogers, Nik Dodani",United States," November 1, 2019",2019,TV-MA,3 Seasons,"TV Comedies, TV Dramas, Teen TV Shows","When a teen on the autism spectrum decides to get a girlfriend, his bid for more independence puts his whole family on a path of self-discovery."
81183624,TV Show,Billy on the Street,,Billy Eichner,United States," November 1, 2019",2016,TV-14,4 Seasons,"International TV Shows, Reality TV, TV Comedies","Comedian Billy Eichner sprints through New York with celebrities to stun pedestrians with unapologetic, unfiltered and unique pop culture questions."
80221999,TV Show,Bondi Rescue,,"Andrew Günsberg, Dean Gladstone, Bruce Hopkins, Trent 'Maxi' Maxwell, Andrew Reid, Ryan Clark, Chris Chapman, Anthony 'Harries' Caroll",Australia," November 1, 2019",2016,TV-PG,1 Season,Reality TV,"This reality series follows elite professional lifeguards on Sydney's Bondi Beach, as they take on everything from animal stings to criminals."
70204963,TV Show,CLANNAD,,"Yuichi Nakamura, David Matranga, Mai Nakahara, Luci Christian, Ryo Hirohashi, Shelley Calene-Black, Ai Nonaka, Hilary Haag, Akemi Kanda, Brittney Karbowski, Houko Kuwashima, Kaytha Coker, Mamiko Noto, Emily Neves, Daisuke Sakaguchi, Greg Ayres",Japan," November 1, 2019",2008,TV-PG,2 Seasons,"Anime Series, Teen TV Shows",Maladjusted high school student Tomoya's life begins to change when he befriends his classmate Nagisa and several other eccentric girls.
80090673,TV Show,Haikyu!!,,"Ayumu Murase, Kaito Ishikawa, Satoshi Hino, Miyu Irino, Yu Hayashi, Koki Uchiyama, Soma Saito, Nobuhiko Okamoto, Yoshimasa Hosoya, Toshiki Masuda, Kaori Nazuka, Hiroshi Kamiya, Kazunari Tanaka, Daisuke Namikawa, Hiroyuki Yoshino, Sumire Morohoshi, Yuichi Nakamura, Yuki Kaji, Shinnosuke Tachibana, Mark Ishii, Ryohei Kimura, Ryota Takeuchi, Hisao Egawa, Subaru Kimura",Japan," November 1, 2019",2015,TV-14,2 Seasons,"Anime Series, International TV Shows, Teen TV Shows","Inspired by a championship match he sees on TV, junior high schooler Hinata joins a volleyball club and begins training, despite his short height."
80239860,TV Show,"Love, Chunibyo & Other Delusions!",,"Jun Fukuyama, Maaya Uchida, Chinatsu Akasaki, Azumi Asakura, Sumire Uesaka, Yuri Amano, Kaori Fukuhara, Mami Shitara, Soichiro Hoshi, Kikuko Inoue, Eri Sendai, Juri Nagatsuma",Japan," November 1, 2019",2014,TV-PG,2 Seasons,"Anime Series, Romantic TV Shows, Teen TV Shows","High schooler Yuta wants to leave his past as a delusional weirdo behind. But his classmate Rikka has her own delusions, and she's interested in his."
80144355,TV Show,Mars,Everardo Gout,"Jihae, Alberto Ammann, Clémentine Poidatz, Anamaria Marinca, Sammi Rotibi, Nicholas Wittman, Cosima Shaw",United States," November 1, 2019",2018,TV-PG,2 Seasons,"Docuseries, Science & Nature TV, TV Dramas",Fact meets fiction in this docudrama chronicling the journey of a spacecraft crew as it embarks in 2033 on a mission to colonize the red planet.
80150290,TV Show,Mobile Suit Gundam: Iron-Blooded Orphans,,"Kengo Kawanishi, Yoshimasa Hosoya, Natsuki Hanae, Yuuichirou Umehara, Yasuaki Takumi, Taishi Murata, Kouhei Amasaki, Mutsumi Tamura, Soma Saito, Yuka Terasaki, Hisako Kanemoto, Takahiro Sakurai, Masaya Matsukaze, Toru Okawa",," November 1, 2019",2016,TV-14,2 Seasons,"Anime Series, International TV Shows","On a terraformed post-disaster Mars, a group of child security agents rebel against the adults who betrayed them and the oppressive Earth government."
81022003,TV Show,The Boulet Brothers Dragula,,Boulet Brothers,United States," November 1, 2019",2019,TV-MA,2 Seasons,Reality TV,"Ten queens must slay the competition and put their fiercest, filthiest faces forward for the chance to be crowned the world's next drag supermonster."
80101401,TV Show,The Deep,,"Vincent Tong, Ashleigh Ball, Kathleen Barr, Michael Dobson, Brian Drummond","Canada, Australia"," November 1, 2019",2019,TV-Y7,3 Seasons,Kids' TV,"The Nektons are a family of underwater explorers who discover the hidden secrets of the oceans, including sunken cities, sea creatures and pirates."
80087857,TV Show,Creators,,"Fabio Aste, Héctor Segura, Sebastian Rosas",Argentina," November 1, 2018",2015,TV-Y,2 Seasons,"Kids' TV, Spanish-Language TV Shows","Two brilliant scientists discover the hidden virtual city of Creápolis, where citizens have the power to solve problems by believing and creating."
80217889,TV Show,Follow This,,"John Stanton, Scaachi Koul, Azeen Ghorayshi, Bim Adewunmi, Juliane Loffler, Charlie Warzel",United States," November 1, 2018",2018,TV-MA,3 Seasons,Docuseries,Follow the reporters at BuzzFeed as they probe topics ranging from quirky internet crazes to safe injection spaces for opioid users.
70308105,TV Show,Grand Hotel,,"Yon González, Amaia Salamanca, Adriana Ozores, Pedro Alonso, Concha Velasco, Llorenç González, Pep Anton Muñoz, Eloy Azorín, Fele Martínez, Luz Valdenebro, Marta Larralde, Antonio Reyes, Iván Morales, Dion Córdoba, Raquel Sierra",Spain," November 1, 2017",2013,TV-PG,3 Seasons,"International TV Shows, Romantic TV Shows, Spanish-Language TV Shows","To learn the truth about his sister's mysterious disappearance, a young man infiltrates a hotel in the guise of a footman and begins an investigation."
70155610,TV Show,That '70s Show,,"Topher Grace, Mila Kunis, Ashton Kutcher, Danny Masterson, Laura Prepon, Wilmer Valderrama, Debra Jo Rupp, Kurtwood Smith, Don Stark, Tanya Roberts, Tommy Chong, Lisa Robin Kelly",United States," November 1, 2017",2005,TV-14,8 Seasons,TV Comedies,"Feel groovy in 1970s suburbia, where a teen and his pals hang in the basement, listening to rock and indulging other hazy benefits of '70s culture."
70279656,TV Show,The Mind of a Chef,,"Anthony Bourdain, David Chang, Sean Brock, April Bloomfield, Edward Lee, Magnus Nilsson, Gabrielle Hamilton, David Kinch, Ludo Lefebvre",United States," November 1, 2017",2016,TV-PG,5 Seasons,Docuseries,Producer and narrator Anthony Bourdain explores the creative processes of international celebrity chefs to learn what fuels their culinary artistry.
70236561,TV Show,Top Boy,,"Ashley Walters, Kane Robinson, Malcolm Kamulete, Shone Romulus, Sharon Duncan Brewster, Giacomo Mancini, Xavien Russell, Kierston Wareing, Geoff Bell, Nicholas Pinnock",United Kingdom," November 1, 2017",2011,TV-MA,2 Seasons,"British TV Shows, Crime TV Shows, International TV Shows","In this gritty, stylish drama series, two London drug dealers ply their lucrative trade at a public housing estate in North London."
70157402,TV Show,Highway to Heaven,,"Michael Landon, Victor French",United States," November 1, 2016",1988,TV-PG,5 Seasons,TV Dramas,"Under God's direction, angel Jonathan and ex-cop Mark help troubled souls overcome adversity and embrace honesty, kindness and forgiveness."
80144588,TV Show,Women Behind Bars,,,United States," November 1, 2016",2010,TV-14,3 Seasons,"Crime TV Shows, Docuseries","This reality series recounts true stories of women who have been convicted for murder, including an in-depth examination of each crime."
80057918,TV Show,Lucifer,,"Tom Ellis, Lauren German, Kevin Alejandro, D.B. Woodside, Lesley-Ann Brandt, Scarlett Estevez, Rachael Harris, Aimee Garcia, Tricia Helfer, Tom Welling, Jeremiah W. Birkett, Pej Vahdat, Michael Gladis",United States," May 8, 2019",2019,TV-14,4 Seasons,"Crime TV Shows, TV Comedies, TV Dramas","Bored with being the Lord of Hell, the devil relocates to Los Angeles, where he opens a nightclub and forms a connection with a homicide detective."
80107369,TV Show,Queen of the South,,"Alice Braga, Veronica Falcón, Justina Machado, Peter Gadiot, Hemky Madera, Gerardo Taracena","United States, Mexico, Spain, Malta"," May 7, 2019",2018,TV-14,3 Seasons,"Crime TV Shows, TV Action & Adventure, TV Dramas","Forced to work for a cartel that recently killed her boyfriend, Teresa relies on her street smarts, a loyal pal and a mysterious notebook to survive."
80208115,TV Show,Prince Jai Aur Dumdaar Viru,Bhavik Thakore,,," May 7, 2018",2017,TV-G,2 Seasons,"Kids' TV, TV Comedies","A prince and a commoner who are best friends keep having to thwart the plots of the prince's scheming, ambitious minister."
80057609,TV Show,Kazoops!,,"Reece Pockney, Scott Langley, Alex Babic, Gemma Harvey, Jessica Hann, Emma Tate",Australia," May 5, 2017",2017,TV-Y,3 Seasons,Kids' TV,Music meets imagination in this inventive animated series about thinking outside the box and having fun.
80023612,TV Show,Kong: King of the Apes,,"Lee Tockar, Sam Vincent, Alessandro Juliani, Tabitha St. Germain, Kathleen Barr, Viv Leacock, Shannon Chan-Kent, Vincent Tong","United States, Japan, Canada"," May 4, 2018",2018,TV-Y7-FV,2 Seasons,Kids' TV,"In 2050, an evil scientist is about to unleash an army of robotic dinosaurs. Now it's up to Kong and friends to fight back and save the day."
80221787,TV Show,Bad Blood,,"Anthony LaPaglia, Kim Coates, Enrico Colantoni, Paul Sorvino, Maxim Roy, Brett Donahue, Michelle Mylett, Claudia Ferri, Tony Nappo",Canada," May 31, 2019",2019,TV-MA,2 Seasons,"Crime TV Shows, TV Dramas","This sprawling crime drama follows the true story of the Rizzuto family and its associates, who presided over organized crime in Montreal for decades."
80209096,TV Show,My Next Guest Needs No Introduction With David Letterman,,"President Barack Obama, George Clooney, Malala Yousafzai, Jay-Z, Tina Fey, Howard Stern, David Letterman",United States," May 31, 2019",2019,TV-MA,2 Seasons,Stand-Up Comedy & Talk Shows,TV legend David Letterman teams up with fascinating global figures for in-depth interviews and curiosity-fueled excursions in this monthly talk show.
80027373,TV Show,Oh No! It's an Alien Invasion,,"Al Mukadam, Dan Chameroy, Seán Cullen, Stacey DePass, Barbara Mamabolo, Robert Tinkler, Ryan Cooley, Brianna Daguanno",Canada," May 31, 2015",2014,TV-Y7-FV,2 Seasons,"Kids' TV, TV Action & Adventure, TV Sci-Fi & Fantasy",Nate and his Super Wicked Extreme Emergency Team –  S.W.E.E.T. – take on alien invaders who have captured all the world's grownups.
80025384,TV Show,Unbreakable Kimmy Schmidt,,"Ellie Kemper, Jane Krakowski, Tituss Burgess, Carol Kane",United States," May 30, 2018",2019,TV-14,4 Seasons,TV Comedies,"When a woman is rescued from a doomsday cult and lands in New York City, she must navigate a world she didn’t think even existed anymore."
80024103,TV Show,American Crime,,"Felicity Huffman, Timothy Hutton, Elvis Nolasco, Regina King, Lili Taylor, Richard Cabral, Brent Anderson, Benito Martinez, Shane Jacobsen, W. Earl Brown, Caitlin Gerard, Penelope Ann Miller, Johnny Ortiz",United States," May 30, 2017",2017,TV-14,3 Seasons,"Crime TV Shows, TV Dramas","This anthology series unfolds a different story arc for each season, with dramas focusing on aspects of American life and the criminal justice system."
80198459,TV Show,Cupcake & Dino - General Services,,"Justin Collette, Mark Little, Kyle Dooley, Mark Forward, Joris Jarksy, Julie Lemieux, Kayla Lorette, Julie Sype","Canada, Brazil"," May 3, 2019",2019,TV-Y7,2 Seasons,"Kids' TV, TV Comedies",An enterprising cupcake and his cheerful dinosaur brother take on jobs of all sorts as they work to help friends and strangers in their eccentric city.
70143825,TV Show,Supernatural,Phil Sgriccia,"Jared Padalecki, Jensen Ackles, Mark Sheppard, Misha Collins, Jim Beaver, Andrea Menard, Samantha Smith, Mark Pellegrino, Alexander Calvert",United States," May 3, 2019",2019,TV-14,14 Seasons,"Classic & Cult TV, TV Action & Adventure, TV Horror","Siblings Dean and Sam crisscross the country, investigating paranormal activity and picking fights with demons, ghosts and monsters."
70252898,TV Show,Total Drama,,"Clé Bennett, Christian Potenza, Scott McCord, Rachel Wilson, Drew Nelson, Stephanie Anne Mills, Novie Edwards, Megan Fahlenbock, Brian Foud, Emilie-Claire Barlow, Phillip David Lewis, Katie Crown, Sarah Gadon, Peter Oldring, Kristin Fairlie, Dan Petronijevic, Adam Greydon Reid","Canada, United States, France"," May 3, 2018",2015,TV-PG,5 Seasons,"Kids' TV, TV Comedies","Heartwarming moments are interspersed with backstabbing, scheming, sabotage and broken alliances in this animated spoof of reality show competitions."
70140358,TV Show,Arrested Development,,"Jason Bateman, Portia de Rossi, Will Arnett, Michael Cera, Alia Shawkat, Tony Hale, David Cross, Jeffrey Tambor, Jessica Walter, Ron Howard",United States," May 29, 2018",2019,TV-14,5 Seasons,TV Comedies,"It's the Emmy-winning story of a wealthy family that lost everything, and the one son who had no choice but to keep them all together."
80066080,TV Show,DC's Legends of Tomorrow,Rob Seidenglanz,"Victor Garber, Brandon Routh, Caity Lotz, Franz Drameh, Amy Pemberton, Dominic Purcell, Maisie Richardson-Sellers, Nick Zano, Arthur Darvill, Wentworth Miller, Tala Ashe, Adam Tsekhman, Christina Brucato, Simon Merrells, Nils Hognestad, Jes Macallan, Keiynan Lonsdale",United States," May 28, 2019",2018,TV-14,4 Seasons,"TV Action & Adventure, TV Sci-Fi & Fantasy","A mysterious ""time master"" from the future unites an unlikely group of superheroes and villains to save the world from a powerful evil."
70210883,TV Show,Hell on Wheels,,"Anson Mount, Colm Meaney, Common, Dominique McElligott, Eddie Spears, Ben Esler, Phil Burke, Christopher Heyerdahl, Robin McLeavy, Tom Noonan","Canada, United Kingdom"," May 28, 2016",2016,TV-14,5 Seasons,"Crime TV Shows, TV Action & Adventure",Former Confederate soldier Cullen Bohannon sets out on a quest to find his wife's killer as post-Civil War America struggles to rebuild its identity.
80065386,TV Show,Supergirl,Jesse Warn,"Melissa Benoist, Mehcad Brooks, Chyler Leigh, Jeremy Jordan, David Harewood, Calista Flockhart, Emma Tremblay, Adrian Pasdar, Katie McGrath, David St. Louis, Odette Annable, Floriana Lima, Erica Durance",United States," May 27, 2019",2019,TV-14,4 Seasons,"TV Action & Adventure, TV Sci-Fi & Fantasy","To avert a disaster, Kara Danvers reveals her powers and true identity: She is Superman's cousin, now known as Supergirl, protector of National City."
70281343,TV Show,Mako Mermaids: An H2O Adventure,,"Lucy Fry, Ivy Latimer, Amy Ruffle, Chai Romruen, Isabel Durant, Allie Bertram, Linda Ngo, Gemma Forsyth, Dominic Deutscher, Kerith Atkinson, Rowan Hills, Brooke Nichole Lee",Australia," May 27, 2016",2016,TV-G,4 Seasons,"Kids' TV, TV Comedies","This ""H2O"" sequel follows Zac, a boy who accidentally turns into a merman and threatens the existence of three young mermaids who guard Mako Island."
80010655,TV Show,Bloodline,,"Kyle Chandler, Ben Mendelsohn, Sissy Spacek, Linda Cardellini, Norbert Leo Butz, Jacinda Barrett, Jamie McShane, John Leguizamo, Enrique Murciano, Sam Shepard, Chloë Sevigny, Andrea Riseborough, Beau Bridges, Taylor Rouviere, Owen Teague, Brandon Larracuente",United States," May 26, 2017",2017,TV-MA,3 Seasons,"TV Dramas, TV Mysteries, TV Thrillers","When the black sheep son of a respected family threatens to expose dark secrets from their past, sibling loyalties are put to the test."
70300066,TV Show,Bitten,,"Laura Vandervoort, Greyston Holt, Greg Bryk, Steve Lund, Paul Greene, Michael Xavier, Genelle Williams",Canada," May 26, 2016",2016,TV-MA,3 Seasons,"International TV Shows, TV Dramas, TV Horror","Elena Michaels tries to stray from the pack of werewolves that turned her into a monster, but her efforts are thwarted by a string of grisly murders."
80075820,TV Show,Trollhunters,,"Kelsey Grammer, Anton Yelchin, Charlie Saxton, Lexi Medrano, Fred Tatasciore, Clancy Brown, Mark Hamill, Ron Perlman, Steven Yeun, Amy Landecker, Jonathan Hyde, Anjelica Huston, Lena Headey, David Bradley, Tom Kenny, Laraine Newman, Grey Griffin, James Purefoy","United States, Mexico"," May 25, 2018",2018,TV-Y7-FV,3 Seasons,"Kids' TV, TV Action & Adventure, TV Sci-Fi & Fantasy","After uncovering a mysterious amulet, an average teen assumes an unlikely destiny and sets out to save two worlds. Created by Guillermo del Toro."
80117554,TV Show,She's Gotta Have It,,"DeWanda Wise, Cleo Anthony, Lyriq Bent, Anthony Ramos, Chyna Layne, Margot Bingham, Ilfanesh Hadera, Elvis Nolasco, De'Adre Aziza",United States," May 24, 2019",2018,TV-MA,2 Seasons,"Romantic TV Shows, TV Comedies, TV Dramas",Nola Darling struggles to stay true to herself and her dreams while juggling three lovers in this Spike Lee series based on his breakout film.
80113612,TV Show,Fauda,,"Lior Raz, Hisham Suliman, Shadi Mar'i, Laëtitia Eïdo, Tsahi Halevi, Yuval Segal, Neta Garty, Tomer Kapon, Itzik Cohen, Rona-Lee Shim'on, Boaz Konforty, Doron Ben-David",Israel," May 24, 2018",2018,TV-MA,2 Seasons,"International TV Shows, TV Action & Adventure, TV Dramas","A top Israeli agent comes out of retirement to hunt for a Palestinian militant he thought he'd killed, setting a chaotic chain of events into motion."
80133311,TV Show,Riverdale,Rob Seidenglanz,"K.J. Apa, Lili Reinhart, Camila Mendes, Cole Sprouse, Marisol Nichols, Madelaine Petsch, Ashleigh Murray, Mädchen Amick, Luke Perry, Casey Cott, Charles Melton, Mark Consuelos, Lochlyn Munro, Peter Bryant, Colin Lawrence, Molly Ringwald, Asha Bromfield, Barclay Hope, Hayley Law, Martin Cummins, Sarah Habel, Nathalie Boltt, Skeet Ulrich",United States," May 23, 2019",2019,TV-14,3 Seasons,"Crime TV Shows, TV Dramas, TV Mysteries","While navigating the troubled waters of sex, romance, school and family, teen Archie and his gang become entangled in a dark Riverdale mystery."
80027042,TV Show,The Flash,Glen Winter,"Grant Gustin, Candice Patton, Danielle Panabaker, Carlos Valdes, Tom Cavanagh, Jesse L. Martin, Neil Sandilands, Britne Oldford, Danielle Nicolet, Keiynan Lonsdale, Kim Engelbrecht",United States," May 22, 2019",2019,TV-14,5 Seasons,"Crime TV Shows, TV Action & Adventure, TV Sci-Fi & Fantasy",A forensics expert who wakes from a coma with amazing new powers squares off against forces threatening the city in this live-action superhero romp.
