80048250,TV Show,The Making of Frozen Planet,,David Attenborough,"United Kingdom, United States, Spain, Germany, Greece, Canada","January 28, 2016",2012,TV-PG,1 Season,"British TV Shows, Docuseries, Science & Nature TV",Documentary crew members brave Earth's most frigid regions to capture the majesty and mystery found in the chillier side of the animal kingdom.
80189619,TV Show,A Taiwanese Tale of Two Cities,,"Tammy Chen, James Wen, Peggy Tseng, Denny Huang",,"January 27, 2019",2018,TV-MA,1 Season,"International TV Shows, TV Dramas","A Taipei doctor and a San Francisco engineer swap homes in a daring pact, embarking on journeys filled with trials, secrets and unexpected encounters."
80099016,Movie,IBOY,Adam Randall,"Bill Milner, Maisie Williams, Rory Kinnear, Miranda Richardson, Jordan Bolger, Charley Palmer Rothwell, Aymen Hamdouchi",United Kingdom,"January 27, 2017",2017,TV-MA,91 min,"International Movies, Sci-Fi & Fantasy, Thrillers","When shards of a cell phone get lodged in a teenager's brain, he discovers he can control electronic devices and uses his newfound power for revenge."
80123792,TV Show,Juana Inés,,"Arcelia Ramírez, Arantza Ruiz, Hernán Del Riego, Margarita Sanz, Lisa Owen, Yolanda Corrales, Carlos Valencia, Mauricio Isaac, Pedro de Tavira Egurrola, Emilio Savinni, Néstor Galván, Paulina Matos, Alberto Collado, Rocío García, Luis Maya, Clementina Guadarrama",Mexico,"January 27, 2017",2016,TV-14,1 Season,"International TV Shows, Spanish-Language TV Shows, TV Dramas","Juana Inés de la Cruz, a powerful feminist nun involved in a forbidden love affair with a woman, faces oppression in 17th-century Mexico."
80132792,TV Show,Shadow of Truth,,,Israel,"January 27, 2017",2016,TV-MA,1 Season,"Crime TV Shows, Docuseries, International TV Shows",This documentary series explores the explosive 2006 murder case of a 13-year-old Israeli girl and the subsequent conviction of a Ukrainian immigrant.
60024962,Movie,Biggie & Tupac,Nick Broomfield,Nick Broomfield,United Kingdom,"January 26, 2019",2002,R,108 min,"Documentaries, Music & Musicals","British documentarian Nick Broomfield investigates the murders of rappers Tupac Shakur and Biggie Smalls, digging up some surprises in the process."
81031181,Movie,Goyo: The Boy General,Jerrold Tarog,"Paulo Avelino, Carlo Aquino, Arron Villaflor, Mon Confiado, Gwen Zamora, Jeffrey Quizon, Alvin Anson, Empress Schuck, Perla Bautista, Benjamin Alves",Philippines,"January 26, 2019",2018,TV-MA,150 min,"Dramas, International Movies","Brash ladies' man Gregorio ""Goyo"" del Pilar rises to become one of the Philippines' youngest generals in this historical epic sequel to ""Heneral Luna."""
80107084,Movie,A Futile and Stupid Gesture,David Wain,"Will Forte, Domhnall Gleeson, Martin Mull, Joel McHale, Matt Lucas, Thomas Lennon, Seth Green, Jackie Tohn, Natasha Lyonne, Emmy Rossum, Elvy Yost, Matt Walsh, John Gemberling, Rick Glassman, Camille Guaty",United States,"January 26, 2018",2018,TV-MA,102 min,Comedies,"In a brief life full of triumph and failure, ""National Lampoon"" co-founder Doug Kenney built a comedy empire, molding pop culture in the 1970s."
80118100,TV Show,Dirty Money,,,United States,"January 26, 2018",2018,TV-14,1 Season,"Crime TV Shows, Docuseries","From crippling payday loans to cars that cheat emissions tests, this investigative series exposes brazen acts of corporate greed and corruption."
80196589,Movie,Fakkah Fuzz: Almost Banned,Michael McKay,Fakkah Fuzz,Singapore,"January 26, 2018",2018,TV-MA,61 min,Stand-Up Comedy,Stand-up comic Fakkah Fuzz mines cross-cultural humor from the experience of growing up as an outspoken Malay man in Singapore.
80183089,Movie,Mau Nieto: Viviendo sobrio… desde el bar,,Mau Nieto,Mexico,"January 26, 2018",2018,TV-MA,57 min,Stand-Up Comedy,"Performing at a bar, Mexican stand-up comedian Mau Nieto dishes on his modest upbringing, his failed relationships and his attempts to stay sober."
80125818,Movie,Mune: Guardian of the Moon,"Alexandre Heboyan, Benoît Philippon","Joshua J. Ballard, Nicole Provost, Trevor Devall, Michael Dobson, Jonathan Love, Davey Grant",France,"January 26, 2018",2014,PG,85 min,Children & Family Movies,"When the old guardian of the moon retires, the mischievous Mune is chosen as his successor, but he worries he's not up to the job."
80192138,Movie,Sebastián Marcelo Wainraich,"Raúl Campos, Jan Suter",Sebastián Marcelo Wainraich,Argentina,"January 26, 2018",2018,TV-MA,49 min,Stand-Up Comedy,"Argentine comedian Sebastián Wainraich highlights the comedy in everyday life, from minibars to reasons why funerals are better than weddings."
80169801,Movie,13TH: A Conversation with Oprah Winfrey & Ava DuVernay,,"Oprah Winfrey, Ava DuVernay",,"January 26, 2017",2017,,37 min,Movies,"Oprah Winfrey sits down with director Ava DuVernay to discuss her Oscar-nominated film, historical cycles of oppression and the broken prison system."
80239629,Movie,Animas,"Laura Alvea, José Ortuño","Clare Durant, Iván Pellicer, Luis Bermejo, Liz Lobato, Chacha Huang, Ángela Molina","Spain, Belgium","January 25, 2019",2018,TV-MA,88 min,"Horror Movies, International Movies",A teen's eerie visions become increasingly frequent and terrifying after her longtime friend gets a girlfriend and his abusive dad is strangely killed.
80145141,TV Show,Black Earth Rising,,"Michaela Coel, John Goodman, Abena Ayivor, Noma Dumezweni, Ronald Guttman, Danny Sapani, Harriet Walter, Tyrone Huggins, Emmanuel Imani, Lucian Msamati, Tamara Tunie",United Kingdom,"January 25, 2019",2018,TV-MA,1 Season,"British TV Shows, International TV Shows, TV Dramas","Adopted by a human rights attorney after the Rwandan genocide, legal investigator Kate Ashby confronts her past when she takes on war crimes cases."
80991879,TV Show,Examination of Conscience,,,Spain,"January 25, 2019",2019,TV-MA,1 Season,"Crime TV Shows, Docuseries, International TV Shows","Allegations of child sexual abuse in Spain's Catholic institutions are examined in interviews with survivors, clergy, journalists and other experts."
80180171,TV Show,Kingdom,Kim Seong-hun,"Ju Ji-hoon, Ryu Seung-ryong, Bae Doona, Kim Sang-ho, Kim Sung-kyu, Jeon Seok-ho, Kim Hye-jun, Heo Jun-ho, Jung Suk-won, Kim Jong-soo","South Korea, United States","January 25, 2019",2019,TV-MA,1 Season,"International TV Shows, Korean TV Shows, TV Action & Adventure","While strange rumors about their ill king grip a kingdom, the crown prince becomes their only hope against a mysterious plague overtaking the land."
81023638,Movie,Mi Obra Maestra,Gastón Duprat,"Guillermo Francella, Luis Brandoni, Raúl Arévalo, Andrea Frigerio, María Soldi, Mónica Duprat, Mahmoud Azim, Santiago Korovsky, Julio Marticorena, Alejandro Paker","Argentina, Spain","January 25, 2019",2018,TV-MA,105 min,"Comedies, International Movies","A sly art dealer tries to revive the career of his longtime pal, a surly painter, with a risky plan that tests their morals and friendship."
80223052,Movie,Polar,,,"United States, Germany","January 25, 2019",2019,TV-MA,119 min,"Action & Adventure, International Movies","An assassin on the verge of retirement must put the good life on hold when his greedy boss sends a squad of young, ruthless killers to take him out."
81020577,TV Show,The Perfect Match,,"Wu Kang-jen, Ivy Shao, Ben Wu, Xiao Man, Nylon Chen",,"January 25, 2019",2017,TV-14,1 Season,"International TV Shows, Romantic TV Shows, TV Comedies","A night market vendor clashes with a lofty celebrity chef in a culinary challenge, fueling the first sparks of a romance."
80190283,Movie,Acts of Vengeance,Isaac Florentine,"Antonio Banderas, Karl Urban, Paz Vega, Robert Forster, Clint Dyer, Cristina Serafini, Lillian Blankenship, Atanas Srebrev, Mark Rhino Smith","Bulgaria, United States","January 25, 2018",2017,R,87 min,"Action & Adventure, International Movies","Devastated by the murder of his wife and child, a formerly fast-talking lawyer takes a vow of silence and trains himself for a mission of revenge."
80148920,Movie,O Silêncio do Céu,Marco Dutra,"Leonardo Sbaraglia, Carolina Dieckmann, Chino Darín, Alvaro Armand Ugon, Mirella Pascual, Roberto Suárez, Paula Cohen, Dylan Cortes, Priscila Bellora, Gabriela Freire, María Mendive",Brazil,"January 25, 2017",2016,TV-MA,102 min,"Dramas, International Movies","After being raped in her home, a married woman chooses not to tell her husband, unaware that he has his own troubled secret and a plan for revenge."
80226612,TV Show,Conversations with a Killer: The Ted Bundy Tapes,,,United States,"January 24, 2019",2019,TV-MA,1 Season,"Crime TV Shows, Docuseries","Present-day interviews, archival footage and audio recordings made on death row form a searing portrait of notorious serial killer Ted Bundy."
80233925,Movie,Hotel Transylvania 3: Summer Vacation,Genndy Tartakovsky,"Adam Sandler, Selena Gomez, Kevin James, Kathryn Hahn, Andy Samberg, David Spade, Steve Buscemi, Fran Drescher, Molly Shannon, Mel Brooks, Keegan-Michael Key",United States,"January 24, 2019",2018,PG,97 min,"Children & Family Movies, Comedies","It's love at first sight for Dracula when he meets Ericka, the charming but mysterious captain of the monster cruise that Mavis plans for the family."
81021098,Movie,Just Love,"Andy Caballero, Diego Corsini","Franco Masini, Yamila Saud, Victorio D'Alessandro, Andrea Frigerio, Gerardo Romano, Bautista Lena, Josefina Ramírez, Noel Schajris, Diana Hernández, Daniela Aita",Argentina,"January 24, 2019",2018,TV-MA,96 min,"Dramas, International Movies, Music & Musicals","Inspired by his love affair with a conservative lawyer, the lead singer of a struggling garage band pens a hit song that propels him to fame."
80194737,Movie,Blockbuster,July Hygreck,"Syrus Shahidi, Lionel Abelanski, Charlotte Gabris, Tom Hygreck, Sylvain Quimene, Laura Boujenah, Foed Amara",France,"January 24, 2018",2017,TV-MA,85 min,"Comedies, Independent Movies, International Movies","Dumped over a video he made to amuse his ailing dad, a heartsick Jérémy hatches an elaborate scheme to win back his superhero-loving girlfriend, Lola."
80214406,TV Show,Prison Playbook,,"Hae-soo Park, Kyung-ho Jung, Dong-il Sung, Krystal Jung, Soo-jeong Ye, Jae-sung Jung, Hoon-jin Lee, Kyoo-hyung Lee, Ho-cheol Lee, Chang-hwan Ahn, Kyung-nam Kim",South Korea,"January 24, 2018",2017,TV-MA,1 Season,"International TV Shows, Korean TV Shows, TV Comedies","With his major league baseball debut right around the corner, a star pitcher lands in prison and must learn to navigate his new world."
80192062,Movie,Ricardo Quevedo: Hay gente así,"Raúl Campos, Jan Suter",Ricardo Quevedo,Colombia,"January 24, 2018",2018,TV-MA,59 min,Stand-Up Comedy,"Droll comic Ricardo Quevedo hits Bogotá with a set that touches on embarrassing misunderstandings, sex talk, the thrill of being scared and more."
80193614,Movie,The Good Catholic,Paul Shoulberg,"Zachary Spicer, Wrenn Schmidt, Danny Glover, John C. McGinley",United States,"January 24, 2018",2017,PG-13,97 min,"Comedies, Dramas, Romantic Movies",A young priest’s faith is tested when he finds himself attracted to a woman he meets at confession and his ideals are shaken to the core.
80117453,Movie,Cristela Alonzo: Lower Classy,Marcus Raboy,Cristela Alonzo,United States,"January 24, 2017",2017,TV-MA,67 min,Stand-Up Comedy,"The irrepressible Alonzo skewers Latino stereotypes, pricey luxuries and her mother's tough-love parenting in a night of sly and infectious comedy."
70296733,Movie,Mitt,Greg Whiteley,Mitt Romney,United States,"January 24, 2014",2014,TV-PG,93 min,Documentaries,The real Mitt Romney is revealed in this documentary that goes beyond the sound bites with unprecedented access to his 2012 presidential campaign.
81026192,TV Show,Innocent,Seren Yüce,"Ali Atay, Haluk Bilginer, Nur Sürer, Okan Yalabık, Tülin Özen, Serkan Keskin, Bartu Küçükçağlayan, Irem Altug, Mehmet Özgür, Merve Ates, Defne Halman, Cem Zeynel Kiliç, Esra Kizildogan",Turkey,"January 23, 2019",2017,TV-MA,1 Season,"Crime TV Shows, International TV Shows, TV Dramas","In a peaceful, rustic town, a retired officer and his family are mired in a murder mystery riddled with shocking, buried secrets."
70109891,Movie,Planet 51,Jorge Blanco,"Dwayne Johnson, Jessica Biel, Justin Long, Gary Oldman, Seann William Scott, John Cleese, Freddie Benedict, Alan Marriott, Mathew Horne, James Corden","Spain, United Kingdom, United States","January 23, 2019",2009,PG,91 min,"Children & Family Movies, Comedies, Sci-Fi & Fantasy","After landing on a planet reminiscent of 1950s suburbia, a human astronaut tries to avoid capture, recover his spaceship and make it home safely."
80003479,Movie,Iceman,Law Wing-cheong,"Donnie Yen, Wang Baoqiang, Shengyi Huang, Yu Kang, Simon Yam, Lam Suet, Singh Hartihan Bitto, Mark Wu","China, Hong Kong","January 23, 2018",2014,R,104 min,"Action & Adventure, International Movies, Sci-Fi & Fantasy","Four hundred years after they were frozen in time, a Ming Dynasty guard and his three pursuers are defrosted to continue their ancient battle."
80163053,Movie,My Entire High School Sinking Into the Sea,Dash Shaw,"Jason Schwartzman, Lena Dunham, Reggie Watts, Maya Rudolph, Susan Sarandon, Thomas Jay Ryan, Alex Karpovsky, Louisa Krause, John Cameron Mitchell, Matthew Maher",United States,"January 23, 2018",2016,PG-13,77 min,"Comedies, Independent Movies","After an earthquake sends their school building drifting into the sea, a group of high-schoolers struggles to survive and overcome clique wars."
80208684,Movie,Todd Glass: Act Happy,Scott Moran,Todd Glass,United States,"January 23, 2018",2018,TV-MA,63 min,Stand-Up Comedy,Try to keep up as comedian Todd Glass delivers rapid-fire stand-up that bounces from his heart attack to his coming out to how to eat a Kit Kat.
80124680,Movie,Gad Gone Wild,Mario Rouleau,Gad Elmaleh,France,"January 23, 2017",2017,TV-MA,57 min,Stand-Up Comedy,French comic Gad Elmaleh regales a Montreal crowd with tales of awkward mix-ups and baffling customs he's encountered since moving to the U.S.
80073486,TV Show,Chelsea Does,,Chelsea Handler,United States,"January 23, 2016",2016,TV-MA,1 Season,"Docuseries, Science & Nature TV","In a provocative documentary series, comedian Chelsea Handler confronts personal and cultural hang-ups around four topics that fascinate her."
70302480,Movie,Iliza Shlesinger: Freezing Hot,,Iliza Shlesinger,,"January 23, 2015",2015,TV-MA,72 min,Stand-Up Comedy,"Smart and brazen comedian Iliza Shlesinger applies her fresh, laugh-out-loud perspective to the universal struggles between men and women."
80175405,Movie,Countdown to Death: Pablo Escobar,"Santiago Diaz, Pablo Martin Farina",,,"January 22, 2018",2017,TV-MA,69 min,"Documentaries, International Movies","Through rare interviews, images and wiretap audio, this documentary reconstructs the last nine years of Colombian drug lord Pablo Escobar's life."
80175290,TV Show,The Traffickers,,Nelufar Hedayat,United States,"January 22, 2018",2016,TV-MA,1 Season,"Crime TV Shows, Docuseries","In this hard-hitting series, journalist Nelufar Hedayat travels the globe to expose an array of black markets, from guns and gold to human body parts."
80214777,Movie,Where's the Money,Scott Zabielski,"Andrew Bachelor, Kat Graham, Mike Epps, Terry Crews, Method Man, Logan Paul, Allen Maldonado, Josh Brener, Devon Werkheiser, Retta",United States,"January 22, 2018",2017,R,86 min,Comedies,"Hunting for a stash of stolen money, a sharp-witted slacker from South Central Los Angeles infiltrates an all-white college fraternity."
80079427,Movie,Ricardo O'Farrill Abrazo Genial,"Raúl Campos, Jan Suter",Ricardo O'Farrill,Mexico,"January 22, 2016",2016,TV-MA,92 min,Stand-Up Comedy,"Ricardo O'Farrill brings his sharp, observational humor to the stage with a relentless sarcasm and specific Mexican sensibility. Prepare for mockery."
81026986,TV Show,Justice,Ahmed Khaled Moussa,"Fatima Al Taei, Mansoor Alfeeli, Malak Al Khalidi, Khalifa Albhri, Nivin Madi, Mohammed Alamry, Bilal Abdullah, Abdullah Almaqbali, Alaa Shaker, Abdullah Bin Haidar, Humaid Alawadi",United Arab Emirates,"January 21, 2019",2018,TV-14,1 Season,"Crime TV Shows, International TV Shows, TV Dramas","Defying pressure to join her father's firm, a determined young lawyer strikes out on her own and fights to maintain faith in Abu Dhabi's justice system."
80216146,TV Show,Love and Hong Kong,,"Eiko Koike, Ryo Yoshizawa, Fumika Baba, Moga Mogami, Tomo Yanagishita, Kaoru Nagata, Ryo Iwamatsu",Japan,"January 20, 2018",2017,TV-14,1 Season,"International TV Shows, Romantic TV Shows, TV Dramas",The lives of five strangers become intertwined forever when a starlet filming a documentary is kidnapped on the streets of Hong Kong.
80149575,Movie,Caida del Cielo,Néstor Sánchez Sotelo,"Muriel Santa Ana, Peto Menahem, Héctor Díaz, Sebastián Wainraich, Karina K., Hernán Jiménez, Fabián Forte, Verónica Intile",Argentina,"January 20, 2017",2016,NR,78 min,"Comedies, International Movies, Romantic Movies","When Julia literally falls into Alejandro's backyard from her apartment above, it's just the jolt that's needed to nudge these two loners together."
80144448,Movie,Pink,Aniruddha Roy Chowdhury,"Tapsee Pannu, Kirti Kulhari, Andrea Tariang, Amitabh Bachchan, Piyush Mishra, Angad Bedi, Vijay Varma, Raashul Tandon, Tushar Pandey, Dhritiman Chatterjee, Mamata Shankar",India,"January 20, 2017",2016,NR,130 min,"Dramas, International Movies","A sexual assault victim, unjustly tried for the attempted murder of her attacker, is defended by a retired lawyer who challenges India's rape culture."
80100936,Movie,Take the 10,Chester Tam,"Josh Peck, Tony Revolori, Kevin Corrigan, Chester Tam, Andy Samberg, Stella Maeve, Jordan Rock, Carlos Alazraqui, Fred Armisen",United States,"January 20, 2017",2017,TV-MA,80 min,Comedies,Two buddies working dead-end cashier jobs endure a mind-blowing series of events on their quest to get to the hip-hop show of their lives.
80192420,Movie,Half Girlfriend,Mohit Suri,"Arjun Kapoor, Shraddha Kapoor, Vikrant Massey, Seema Biswas, Rhea Chakraborty, Sujata Sehgal, Anisa Butt",India,"January 2, 2020",2017,TV-PG,129 min,"Dramas, International Movies, Romantic Movies","Small-town Madhav falls for big-city Riya and wants her to be his girlfriend. But she views their relationship differently, and suggests a compromise."
81160763,TV Show,"Sex, Explained",,Janelle Monáe,United States,"January 2, 2020",2020,TV-MA,1 Season,"Docuseries, Science & Nature TV","From the biology of attraction to the history of birth control, explore the ins and outs of sex in this entertaining and enlightening series."
81054827,TV Show,Thieves of the Wood,,"Matteo Simoni, Tom Van Dyck, Stef Aerts, Anne-Laure Vandeputte, Jeroen Perceval, Charlotte Timmers, Dirk Roofthooft, Anemone Valcke",Belgium,"January 2, 2020",2019,TV-MA,1 Season,"International TV Shows, TV Action & Adventure, TV Dramas",Charismatic highwayman Jan de Lichte leads the oppressed and downtrodden in a revolt against the corrupt aristocracy of 18th-century Flanders.
81020692,TV Show,Déjà Vu,,"Mandy Wei, Yao Yuan Hao, Wang Si Ping, Yang Zheng, Jenna Wang, Nylon Chen",,"January 2, 2019",2013,TV-14,1 Season,"International TV Shows, Romantic TV Shows, TV Dramas","After losing everything, a prima ballerina accepts a stranger's offer to dial back time and reclaim what was taken from her – but at a great price."
771476,Movie,Monty Python and the Holy Grail,"Terry Gilliam, Terry Jones","Graham Chapman, John Cleese, Eric Idle, Terry Gilliam, Terry Jones, Michael Palin, Connie Booth, Carol Cleveland, Neil Innes",United Kingdom,"January 2, 2019",1975,PG,92 min,"Action & Adventure, Classic Movies, Comedies",The Monty Python comedy clan skewers King Arthur and his Knights of the Round Table as they quest far and wide for the Holy Grail.
80213401,Movie,Haunters: The Art of the Scare,Jon Schnitzer,,United States,"January 2, 2018",2017,TV-MA,89 min,"Documentaries, Horror Movies","This documentary takes us into the world of those who create horror simulations for willing audiences, and examines the culture they have spawned."
80198056,Movie,Mustang Island,Craig Elrod,"Macon Blair, Lee Eddy, John Merriman, Byron Brown, Jason Newman",United States,"January 2, 2018",2017,TV-14,86 min,"Comedies, Dramas, Independent Movies","After being dumped on New Year's Eve, Bill pursues his ex-girlfriend to an off-season Gulf Coast beach town, but things get complicated along the way."
80208083,Movie,The Jack King Affair,"Benjamin Cohen, Nicolas Cotto",,France,"January 2, 2018",2015,TV-14,52 min,"Documentaries, International Movies",This documentary explores a bold World War II operation in which an MI5 agent infiltrated a fascist network to intercept stolen documents.
80045818,Movie,Auschwitz: Blueprints of Genocide,Mike Rossiter,Roy Marsden,United Kingdom,"January 19, 2019",1994,TV-PG,49 min,Documentaries,Newly released KGB files expose evidence proving how architects and engineers conspired with the Nazis to build a camp designed for genocide.
80195429,Movie,Harith Iskander: I Told You So,Michael McKay,Harith Iskander,United States,"January 19, 2018",2018,TV-PG,62 min,Stand-Up Comedy,"Malaysian stand-up comedy icon Harith Iskander takes the stage in Kuala Lumpur to talk about Singapore, a past girlfriend, Rick Astley and more."
80158485,Movie,Step Sisters,Charles Stone III,"Megalyn Echikunwoke, Eden Sher, Lyndon Smith, Gage Golightly, Matt McGorry, Marque Richardson, Alessandra Torresani, Naturi Naughton, Nia Jervier, Robert Curtis Brown",United States,"January 19, 2018",2018,TV-14,108 min,Comedies,"With her Harvard Law dreams on the line, a black sorority leader agrees to help a rhythmically challenged sisterhood win a step dance championship."
80198661,Movie,The Open House,"Matt Angel, Suzanne Coote","Dylan Minnette, Piercey Dalton, Patricia Bethune, Sharif Atkins, Aaron Abrams, Edward Olson, Katie Walder, Paul Rae",United States,"January 19, 2018",2018,TV-MA,95 min,"Horror Movies, Thrillers","Following a tragedy, a mother and her teen son move to a relative's vacant vacation home, where eerie and unexplained forces conspire against them."
80119375,Movie,Good Kids,Chris McCoy,"Nicholas Braun, Zoey Deutch, Mateo Arias, Israel Broussard, Dayo Okeniyi, Julia Garner, Kevin Chapman, Ashley Judd",United States,"January 19, 2017",2016,R,90 min,"Comedies, Independent Movies",Four overachieving friends spend the summer after finishing high school doing everything possible to enjoy the party life and ruin their reputations.
70271454,Movie,The Bling Ring,Sofia Coppola,"Emma Watson, Leslie Mann, Carlos Miranda, Israel Broussard, Taissa Farmiga, Katie Chang, Georgia Rock, Claire Julien","United States, United Kingdom, France, Germany, Japan","January 18, 2020",2013,R,91 min,"Dramas, Independent Movies","Based on fact, this comic thriller tracks the saga of the Hollywood Hills Burglar Bunch, who used the Web to time their robberies of stars' homes."
80207371,Movie,Close,,"Noomi Rapace, Sophie Nélisse, Indira Varma, George Georgiou, Christopher Sciueref, Eoin Macken","United Kingdom, United States","January 18, 2019",2019,TV-MA,95 min,"Action & Adventure, International Movies","When attackers target the heiress she's protecting, battle-hardened bodyguard Sam scrambles to save her client – and teach her how to fight back."
81035279,Movie,FYRE: The Greatest Party That Never Happened,Chris Smith,,United States,"January 18, 2019",2019,TV-MA,98 min,Documentaries,"The Fyre Festival was billed as a luxury music experience on a posh private island, but it failed spectacularly in the hands of a cocky entrepreneur."
80134721,Movie,IO,Jonathan Helpert,"Margaret Qualley, Anthony Mackie, Danny Huston",United States,"January 18, 2019",2019,TV-14,96 min,"Dramas, Sci-Fi & Fantasy","As a young scientist searches for a way to save a dying Earth, she finds a connection with a man who's racing to catch the last shuttle off the planet."
81041182,Movie,Lady-Like,,"Allie Gallerani, Beverly D'Angelo, Olivia Luccardi, Stephanie Simbari, Nick Clark, Brian Wiles",United States,"January 18, 2019",2018,NC-17,83 min,"Comedies, Independent Movies","After she pushes her best friend Kort to date a handsome transfer student, college student Allie is left to tackle adulthood on her own."
81038575,TV Show,Legends of Strength,,"Eugen Sandow, Apollon",United States,"January 18, 2019",2017,TV-PG,1 Season,Docuseries,"From a circus entertainer to a grip master, meet the bodybuilding heroes who defied physical limits and redefined the meaning of strength."
81020612,TV Show,Memory Love,,"Andy Chen, Mandy Wei, Jolin Chien, Mandy Tao, Kris Shen, Nylon Chen",,"January 18, 2019",2017,TV-14,1 Season,"International TV Shows, Romantic TV Shows, TV Dramas","Losing her memory – and her boyfriend – after a car accident, Jia-en crosses paths with a heart transplant recipient who helps her recall her past."
81038976,Movie,Old Lord Savanna,André D'Elia,Leonardo Ribeiro,Brazil,"January 18, 2019",2018,TV-PG,96 min,"Documentaries, International Movies",This documentary captures the environmental and societal impact of Brazil's Cerrado savanna suffering from severe deforestation.
80988257,Movie,Patria,Matías Gueilburt,Paco Ignacio Taibo II,Mexico,"January 18, 2019",2019,TV-MA,90 min,"Documentaries, International Movies","Paco Ignacio Taibo II brings his book trilogy to life, highlighting Mexico's history in 1854-1867, a period he considers foundational to the country."
81023713,Movie,Soni,Ivan Ayr,"Geetika Vidya Ohlyan, Saloni Batra, Mohinder Gujral, Mohit Chauhan, Vikas Shukla, Gauri Chakraborty, Simrat Kaur, Dimple Kaur",India,"January 18, 2019",2018,TV-MA,97 min,"Dramas, Independent Movies, International Movies","While fighting crimes against women in Delhi, a short-fused policewoman and her level-headed female boss grapple with gender issues in their own lives."
