80131414,Movie,Born to Be Free,Gayane Petrosyan,"Casting a light on the mistreatment of sea mammals, this documentary follows the plight of 18 Beluga whales kept in captivity for years.","United Kingdom, Russia","April 1, 2017",2016,TV-14,74 min,"Documentaries, International Movies","Casting a light on the mistreatment of sea mammals, this documentary follows the plight of 18 Beluga whales kept in captivity for years."
80123567,TV Show,Burned Cocoon,,"Yavuz Bingöl, Basak Köklükaya, Çolpan Ilhan, Mustafa Alabora, Sedef Avcı, Ayça İnci, Tuncer Necmioğlu, Serdar Özer",Turkey,"April 1, 2017",2005,TV-14,1 Season,"International TV Shows, TV Dramas","A secret marriage unites two families – one wealthy and traditional, the other bankrupt and modern – and is threatened by the resulting conflicts."
80170612,Movie,Celluloid Man,Shivendra Singh Dungarpur,P.K. Nair,India,"April 1, 2017",2012,TV-PG,156 min,"Documentaries, International Movies","This documentary chronicles the philosophy and life's work of archivist P.K. Nair, who made a mission of preserving Indian cinema’s rich history."
80144890,Movie,Couples Counseling,Alexandre Reinecke,"Zezé Polessa, Daniel Dantas, Paulo Vilhena, Fernanda Paes Leme, Juliana Mesquita",Brazil,"April 1, 2017",2016,TV-MA,88 min,"Comedies, Dramas, International Movies",A seasoned couples therapist comes to realize she might need help with her own marriage after meeting a new pair of young clients.
80106786,Movie,Dancing Quietly,Philipp Eichholtz,"Martina Schöne-Radunski, Hans-Heinrich Hardt, Sebastian Fräsdorf, Claudia Jacob, Deleila Piasko, Tobias Borchers, Ruth Bickelhaupt",Germany,"April 1, 2017",2016,TV-MA,70 min,"Dramas, Independent Movies, International Movies","After years of battling a deep depression, a young woman attempts to pass an important exam with the help of a fellow student."
80115101,Movie,Deuces,Jamal Hill,"Larenz Tate, Meagan Good, Lance Gross, Antonique Smith, La La Anthony, Rick Gonzalez, Rotimi, Andra Fuller",United States,"April 1, 2017",2016,TV-MA,88 min,Dramas,"Assigned to go undercover to take down an impenetrable crime ring, a detective finds himself falling under the sway of its enigmatic leader."
80141261,Movie,Don't Look Down,Daniel Gordon,Richard Branson,United Kingdom,"April 1, 2017",2016,TV-MA,93 min,"Documentaries, International Movies","Aided by dramatic reconstructions and archive footage, Sir Richard Branson recounts his daring attempts to break hot air balloon records."
80158482,Movie,Elaan,K. Ramanlal,"Vinod Mehra, Rekha, Vinod Khanna, Helen, Madan Puri, Brahm Bhardwaj",India,"April 1, 2017",1971,TV-PG,143 min,"Action & Adventure, Cult Movies, International Movies","Journalist Naresh is hired to probe illegal activities on an island. When he's captured, a fellow prisoner gives him a ring with magic powers."
70266998,TV Show,Fairy Tail,,"Tetsuya Kakihara, Aya Hirano, Rie Kugimiya, Yuichi Nakamura, Sayaka Ohara, Satomi Sato, Yui Horie, Hiroki Yasumoto, Ryoko Ono, Hiroki Touchi, Shinpachi Tsuji, Wataru Hatano, Mai Nakahara, Katsuyuki Konishi, Eri Kitamura, Todd Haberkorn, Cherami Leigh, Tia Lynn Ballard, Newton Pittman, Colleen Clinkenbeard, Brittney Karbowski, Jad Saxton, Christopher R. Sabat, Monica Rial, Rick Keeling, R. Bruce Elliott, David Wald, Brina Palencia, Patrick Seitz, Jamie Marchi",Japan,"April 1, 2017",2010,TV-14,1 Season,"Anime Series, International TV Shows","When four young wizards team up to take jobs across the kingdom, they forge a bond more powerful than any magic and grow stronger with every mission."
80081955,Movie,Five Nights in Maine,Maris Curran,"David Oyelowo, Dianne Wiest, Rosie Perez, Teyonah Parris, Hani Furstenberg, Bill Raymond",United States,"April 1, 2017",2015,TV-14,83 min,"Dramas, Independent Movies","After his wife dies in a car accident, a grief-stricken man visits his estranged mother-in-law in Maine, where they try to help each other heal."
80164112,Movie,Joe Cocker: Mad Dog with Soul,John Edginton,,United Kingdom,"April 1, 2017",2017,TV-14,90 min,"Documentaries, International Movies, Music & Musicals","From his star turn at Woodstock to his battles with addiction, this film chronicles the stormy life and unique talent of soulful singer Joe Cocker."
80122240,TV Show,Khelti Hai Zindagi Aankh Micholi,,"Ulka Gupta, Gautami Kapoor, Reema Shaikh, Vinay Jain, Manav Gohil, Helly Shah",India,"April 1, 2017",2013,TV-14,1 Season,"International TV Shows, TV Dramas","The life of a 14-year-old girl is thrown into turmoil when her father dies, forcing her mother to make hard choices for their family."
70302835,Movie,Killa,Avinash Arun,"Amruta Subhash, Archit Deodhar, Parth Bhalerao, Gaurish Gawade, Atharva Upasni, Swandand Raikar, Shrikant Yadav, Umesh Jagtap, Shivalati Bokil, Jui Kahate",India,"April 1, 2017",2014,TV-14,107 min,"Dramas, International Movies",Growing up poses challenges for Chinu when he moves from city to country and encounters a youth culture far different from what he's used to.
80125512,Movie,Lavender,Ed Gass-Donnelly,"Abbie Cornish, Diego Klattenhoff, Justin Long, Dermot Mulroney, Lola Flanery, Sarah Abbott, Liisa Repo-Martell, Peyton Kennedy","Canada, United States","April 1, 2017",2016,NR,93 min,"Dramas, International Movies, Thrillers","After discovering old fractures in her skull, a photographer recovering from amnesia becomes increasingly haunted by a sinister childhood secret."
70129457,Movie,Life 2.0,Jason Spingarn-Koff,,United States,"April 1, 2017",2010,NR,99 min,Documentaries,Computer users across the globe log onto the virtual world of Second Life. But some users' lives are dramatically consumed by this alternate reality.
80121873,TV Show,Maharakshak: Aryan,,"Aakarshan Singh, Vikramjeet Virk, Reena Aggarwal, Khalid Siddiqui, Abigail Jain, Rishabh Jain",India,"April 1, 2017",2014,TV-14,1 Season,"International TV Shows, TV Action & Adventure, TV Sci-Fi & Fantasy","Shy nerd Aryan learns soon after his 18th birthday that he has inherited superpowers, which he must use to vanquish a variety of evil threats."
70205014,TV Show,Ouran High School Host Club,Takuya Igarashi,"Maaya Sakamoto, Monica Rial, Vic Mignogna, Luci Christian, Mamoru Miyano, Kenichi Suzumura, Mike McFarland, Caitlin Glass, Ayaka Saito, Daisuke Kirii",Japan,"April 1, 2017",2006,TV-14,1 Season,"Anime Series, Romantic TV Shows, Teen TV Shows","New student Haruhi stumbles on the Ouran High School Host Club, an all-male group that makes money by entertaining the girls of the school."
80122186,TV Show,Razia Sultan,,"Pankhuri Awasthy, Saurabh Pandey, Rohit Purohit, Sooraj Tapar, Mohit Abrol, Seema Kapoor",India,"April 1, 2017",2015,TV-14,1 Season,"International TV Shows, Romantic TV Shows, TV Dramas","This sweeping historical drama charts the rise of a remarkable real-life figure, the first woman to ever rule the Delhi Sultanate."
80158479,Movie,Salaakhen,A. Salaam,"Shashi Kapoor, Sulakshana Pandit, Mehmood, Sudhir, Anjana Mumtaz, Sajjan, M. Rajan, Mac Mohan, Amrish Puri, Ramesh Deo",India,"April 1, 2017",1975,TV-14,134 min,"Action & Adventure, International Movies, Music & Musicals","Two close childhood friends take drastically different paths in life, but meet by chance years later and fall in love, unaware of their past bond."
80122190,TV Show,Satrangi,,Deepali Sahay,,"April 1, 2017",2014,TV-PG,1 Season,"Docuseries, International TV Shows",Young musicians from 13 states in India demonstrate their cultural heritage by performing regional folk music using traditional instruments.
80104318,Movie,Silicon Cowboys,Jason Cohen,,United States,"April 1, 2017",2016,TV-PG,77 min,Documentaries,"This documentary tells the story of Compaq Computer and its three founders, who in 1982, took on Goliath IBM at the height of its PC dominance."
80100054,Movie,Skins,Eduardo Casanova,"Ana Polvorosa, Candela Peña, Macarena Gómez, Carmen Machi, Jon Kortajarena, Secun de la Rosa, Itziar Castro, Antonio Durán 'Morris', Joaquín Climent, Ana María Ayala, Eloi Costa",Spain,"April 1, 2017",2017,TV-MA,78 min,"Dramas, International Movies","Deformed, disfigured characters must find a way to deal with society shunning their differences in this darkly comic social drama."
80097468,Movie,The Bad Kids,"Keith Fulton, Louis Pepe",,United States,"April 1, 2017",2016,TV-MA,101 min,Documentaries,"In this documentary, teachers at a Mojave Desert high school adhere to a belief that compassion and life skills can profoundly help at-risk students."
80171439,Movie,The Human Factor: The Untold Story of the Bombay Film Orchestras,Rudradeep Bhattacharjee,,India,"April 1, 2017",2013,TV-PG,53 min,"Documentaries, International Movies, Music & Musicals",A family of Parsi musicians collectively works for over 60 years scoring the orchestral soundtracks for some of Bollywood's most memorable films.
80104237,Movie,The Tenth Man,Daniel Burman,"Alan Sabbagh, Julieta Zylberberg, Usher Barilka, Elvira Onetto, Adrián Stoppelman, Dan Breitman, Elisa Carricajo",Argentina,"April 1, 2017",2016,TV-MA,81 min,"Dramas, International Movies","After spending much of his adult life in New York, an affable economist returns home to Buenos Aires and tries to reconnect with his aloof father."
80093107,Movie,Toro,Kike Maíllo,"Mario Casas, Luis Tosar, José Sacristán, Claudia Canal, José Manuel Poga, Ingrid García Jonsson, Luichi Macías",Spain,"April 1, 2017",2016,NR,106 min,"Dramas, International Movies, Thrillers",Ex-con Toro's brother and former partner in crime makes a desperate plea for help that may put Toro back behind bars ... if he survives at all.
80094557,TV Show,Cyborg 009 VS Devilman,,"Jun Fukuyama, Shintaro Asanuma, Haruka Shiraishi, Tomoaki Maeno, M・A・O, Hiroki Touchi, Takeshi Koyama, Yu Mizushima, Hozumi Goda, Ayumu Okamura, Saori Hayami, Satoshi Hino, Johnny Yong Bosch, Bryce Papenbrook, Christine Marie Cabanos, Spike Spencer, Stephanie Sheh, Michael Sinterniklaas, Keith Silverstein, Joey Lotsko, Tony Azzolino, Steve Staley, Cristina Vee, Christopher Corey Smith",Japan,"April 1, 2016",2015,TV-14,1 Season,"Anime Series, International TV Shows","When a Black Ghost scientist releases newly modified cyborgs and mysterious demons appear in Tokyo, the worlds of ""Devilman"" and ""Cyborg 009"" meet."
80085438,Movie,Frank and Cindy,G.J. Echternkamp,,United States,"April 1, 2016",2007,TV-MA,70 min,Documentaries,"Frank was a rising pop star when he married Cindy, but decades of dashed dreams and alcoholism have left the pair struggling to find happiness."
80085439,Movie,Frank and Cindy,G.J. Echternkamp,"Rene Russo, Oliver Platt, Johnny Simmons, Jane Levy, Marc Maron, Ron Myles, Jessica Garrison, Fabianne Therese",United States,"April 1, 2016",2015,R,102 min,"Comedies, Dramas, Independent Movies",A student filmmaker vengefully turns his camera on his bitter mom and washed-up rock star stepdad in this dramedy based on a documentary.
80011846,Movie,Iverson,Zatella Beatty,Allen Iverson,United States,"April 1, 2016",2014,NR,88 min,"Documentaries, Sports Movies","This unfiltered documentary follows the rocky life and stratospheric career of Allen Iverson, an NBA icon who left an indelible mark on the sport."
80064521,Movie,Jeremy Scott: The People's Designer,Vlad Yudin,Jeremy Scott,United States,"April 1, 2016",2015,PG-13,109 min,Documentaries,The journey of fashion designer Jeremy Scott from humble roots on a Missouri farm to creative director of Moschino is charted in this documentary.
80106136,TV Show,Yo-Kai Watch,,"Johnny Yong Bosch, J.W. Terry, Alicyn Packard, Melissa Hutchison, Pierre Holloway, Brent Pendergrass",United States,"April 1, 2016",2015,TV-Y7,1 Season,"Anime Series, Kids' TV","Nate frees a mythical being trapped in a magic capsule, and the two new friends have adventures with all sorts of troublesome supernatural creatures."
70259784,TV Show,DreamWorks Happy Holidays from Madagascar,,"Tom McGrath, Chris Miller, Christopher Knights, John DiMaggio, Ben Stiller, Chris Rock, David Schwimmer, Jada Pinkett Smith, Cedric the Entertainer, Andy Richter, Carl Reiner",United States,"April 1, 2013",2005,TV-PG,1 Season,"Kids' TV, TV Comedies",Madagascar goes wild with holiday spirit in this set of Valentine's Day and Christmas-themed tales featuring everyone's favorite animal characters.
80136796,TV Show,Show Me the Money,,"Afdlin Shauki, Patrick Teoh, Mano Maniam, Rashid Salleh, Soefira Jaafar, Nell Ng, Juliana Ibrahim, Wandy She",," September 9, 2018",2004,TV-14,2 Seasons,"International TV Shows, TV Comedies",Four ordinary family members find their lives turned upside down when they become overnight millionaires thanks to an unlikely benefactor.
70270745,TV Show,Ripper Street,,"Matthew Macfadyen, Jerome Flynn, Adam Rothenberg, David Wilmot, MyAnna Buring, David Dawson, Amanda Hale, Charlene McKenna, Jonathan Barnwell, Clive Russell","United Kingdom, Ireland"," September 8, 2017",2017,TV-MA,5 Seasons,"British TV Shows, Crime TV Shows, TV Dramas","It's been six months since the last Jack the Ripper killing, and East London is hopeful that his reign of terror might have run its course."
70177067,TV Show,Haven,,"Emily Rose, Lucas Bryant, Nicholas Campbell, Eric Balfour, Richard Donat, John Dunsworth, Maurice Dean Wint, Adam Copeland","Canada, United States"," September 8, 2015",2015,TV-14,5 Seasons,"Classic & Cult TV, TV Horror, TV Mysteries","Residents of Haven, Maine, are plagued by supernatural afflictions. To reveal the truth, FBI agent Audrey Parker must delve into her own strange past."
80002612,TV Show,Marvel's Iron Fist,,"Finn Jones, Jessica Henwick, David Wenham, Jessica Stroup, Tom Pelphrey",United States," September 7, 2018",2018,TV-MA,2 Seasons,"Crime TV Shows, TV Action & Adventure, TV Dramas","Danny Rand resurfaces 15 years after being presumed dead. Now, with the power of the Iron Fist, he seeks to reclaim his past and fulfill his destiny."
80095988,TV Show,Stretch Armstrong & the Flex Fighters,,"Scott Menville, Steven Yeun, Ogie Banks, Wil Wheaton, Keith David, Miguel Ferrer, David Kaye, Kate Mulgrew, Nazneen Contractor, Felicia Day",United States," September 7, 2018",2018,TV-Y7-FV,2 Seasons,Kids' TV,Jake Armstrong and his best friends are unexpectedly transformed into superheroes who learn to reach far beyond the limits of any ordinary teenager.
80024113,TV Show,Galavant,,"Joshua Sasse, Timothy Omundson, Vinnie Jones, Mallory Jansen, Karen David, Luke Youngblood",United States," September 7, 2016",2016,TV-PG,2 Seasons,"TV Action & Adventure, TV Comedies","In a time of legend, Galavant the knight embarks on a quest to save his fair lady and become a hero in this tongue-in-cheek musical comedy."
80200942,TV Show,Elite,,"Danna Paola, Miguel Herrán, María Pedraza, Itzan Escamilla, Miguel Bernardeau, Jaime Lorente, Álvaro Rico, Arón Piper, Mina El Hammani, Ester Expósito, Omar Ayuso",Spain," September 6, 2019",2019,TV-MA,2 Seasons,"Crime TV Shows, International TV Shows, Spanish-Language TV Shows","When three working-class teens enroll in an exclusive private school in Spain, the clash between them and the wealthy students leads to murder."
80186848,TV Show,Jack Whitehall: Travels with My Father,,"Jack Whitehall, Michael Whitehall",United Kingdom," September 6, 2019",2019,TV-MA,3 Seasons,"British TV Shows, Docuseries, International TV Shows","Jovial comic Jack Whitehall invites his stuffy father, Michael, to travel with him through Southeast Asia in an attempt to strengthen their bond."
70197049,TV Show,Once Upon a Time,"Mario Van Peebles, Ralph Hemecker, Gwyneth Horder-Payton, Milan Cheylov, Dean White, Michael Waxman, Bryan Spicer","Lana Parrilla, Robert Carlyle, Jared Gilmore, Jennifer Morrison, Ginnifer Goodwin, Josh Dallas, Colin O'Donoghue, Emilie de Ravin",United States," September 6, 2018",2018,TV-PG,7 Seasons,"TV Dramas, TV Sci-Fi & Fantasy","In this fantasy series, a young woman is drawn to a small Maine town and discovers that it's filled with elements of the fairy tale world."
70283260,TV Show,Reign,,"Adelaide Kane, Megan Follows, Torrance Coombs, Toby Regbo, Jenessa Grant, Celina Sinden, Caitlin Stasey, Anna Popplewell, Alan Van Sprang, Rossif Sutherland, Jonathan Keltz, Sean Teale, Craig Parker",United States," September 5, 2017",2017,TV-14,4 Seasons,TV Dramas,"This vivid historical drama series tells of the rise to power of Mary, Queen of Scots, amid a court full of sexual and political intrigue."
70143860,TV Show,The Vampire Diaries,,"Nina Dobrev, Paul Wesley, Ian Somerhalder, Steven R. McQueen, Sara Canning, Kat Graham, Candice King, Zach Roerig, Michael Trevino, Matthew Davis, Joseph Morgan",United States," September 4, 2017",2017,TV-14,8 Seasons,"TV Dramas, TV Mysteries, TV Sci-Fi & Fantasy","Trapped in adolescent bodies, feuding vampire brothers Stefan and Damon vie for the affection of captivating teenager Elena."
80020542,TV Show,Gotham,Danny Cannon,"Ben McKenzie, Donal Logue, Jada Pinkett Smith, David Mazouz, Sean Pertwee, Camren Bicondova, Robin Lord Taylor, Cory Michael Smith, Erin Richards, John Doman, Victoria Cartagena, Andrew Stewart-Jones, Larry Pine, Jessica Lucas, Maggie Geha, Charlie Tahan, Drew Powell, Morena Baccarin, Anthony Carrigan, Crystal Reed, Chris Chalk, Damian Young, Michael Buscemi, Alexander Siddig, Michael Maize",United States," September 30, 2019",2019,TV-14,5 Seasons,"Crime TV Shows, TV Action & Adventure, TV Dramas","Long before he was commissioner, rookie cop James Gordon takes on Gotham City crime and corruption to avenge the murder of Bruce Wayne's parents."
80074503,TV Show,Real Rob,,"Rob Schneider, Patricia Schneider, Jamie Lissow, Miranda Scarlett Schneider",United States," September 29, 2017",2017,TV-MA,2 Seasons,TV Comedies,Go inside the world of comedian and actor Rob Schneider in this comedy series that follows the ups and downs of his career and family life.
80217957,TV Show,Reboot: The Guardian Code,,"Ty Wood, Sydney Scotia, Ajay Friese, Gabriel Darku, Hannah Vandenbygaart, Timothy E. Brummund, Bob Frazer, Octavian Kaul, Nicholas Lea, Kirsten Robek, Alex Zahara",Canada," September 28, 2018",2018,TV-Y7-FV,2 Seasons,Kids' TV,Four tech-savvy teens hone their skills as cyber-superheroes in a series of secret missions to save the world.
80113201,TV Show,Skylanders Academy,,"Justin Long, Ashley Tisdale, Jonathan Banks, Chris Diamantopoulos, Bobcat Goldthwait, Richard Steven Horvitz, Norm MacDonald, Daniel Middleton, Catherine O'Hara, Parker Posey, Jonny Rees, Jason Ritter, Susan Sarandon, Harland Williams, Daniel Wu, Dee Bradley Baker, Chris Cox, Jim Cummings, Felicia Day, John DiMaggio, Grey Griffin","South Korea, United States"," September 28, 2018",2018,TV-Y7,3 Seasons,"Kids' TV, TV Comedies",Travel the vast Skylander universe in this animated series as a ragtag group of academy graduates build trust and heart in their fight against evil.
80115297,TV Show,El Marginal,,"Juan Minujín, Martina Gusman, Gerardo Romano, Claudio Rissi, Carlos Portaluppi, Nicolás Furtado, Cristina Banegas, Abel Ayala",Argentina," September 27, 2019",2019,TV-MA,3 Seasons,"Crime TV Shows, International TV Shows, Spanish-Language TV Shows","While investigating a kidnapping, an ex-cop sent to infiltrate a prison finds himself surrounded by dangerous felons who can't know his real identity."
80216752,TV Show,Explained,,,United States," September 26, 2019",2019,TV-14,2 Seasons,Docuseries,"This enlightening series from Vox digs into a wide range of topics such as the rise of cryptocurrency, why diets fail, and the wild world of K-pop."
80180182,TV Show,Norsemen,,"Kåre Conradi, Silje Torp, Nils Jørgen Kaalstad, Marian Saastad Ottesen, Trond Fausa, Kristine Riis, Jon Øigarden, Henrik Mestad, Øystein Martinsen, Mikkel Bratt Silset, Mads Jørgensen, Nikis Theophilakis",Norway," September 26, 2018",2018,TV-MA,2 Seasons,"International TV Shows, TV Comedies","The residents of an 8th-century Viking village experience political rivalry, social change and innovations that upend their culture and way of life."
80131479,TV Show,Terrace House: Aloha State,,"You, Reina Triendl, Ryota Yamasato, Yoshimi Tokui, Azusa Babazono, Kentaro","United States, Japan"," September 26, 2017",2017,TV-14,4 Seasons,"International TV Shows, Reality TV","The beautiful island of Oahu is host to a new batch of six strangers who share a single roof, multiple conflicts and no script in this reality series."
80057883,TV Show,Abstract: The Art of Design,,"Christoph Niemann, Tinker Hatfield, Es Devlin, Bjarke Ingels, Paula Scher, Platon, Ilse Crawford, Ralph Gilles",United States," September 25, 2019",2019,TV-14,2 Seasons,Docuseries,Step inside the minds of the most innovative designers in a variety of disciplines and learn how design impacts every aspect of life.
80108495,TV Show,Glitch,,"Patrick Brammall, Genevieve O'Reilly, Emma Booth, Emily Barclay, Ned Dennehy, Sean Keenan, Hannah Monson, Aaron L. McGrath, John Leary, Rodger Corser, Andrew McFarlane, Luke Arnold, Rob Collins, Pernilla August",Australia," September 25, 2019",2019,TV-MA,3 Seasons,"International TV Shows, TV Dramas, TV Horror",A police officer and a doctor face an emotionally charged mystery when seven local residents inexplicably return from the dead in peak physical form.
80059465,TV Show,Locked Up,,"Maggie Civantos, Najwa Nimri, Carlos Hipólito, Roberto Enríquez, Cristina Plazas, Berta Vázquez, Alba Flores, Inma Cuevas, María Isabel Díaz, María Salgueiro, Ramiro Blas, Alberto Velasco, Marta Aledo, Daniel Ortiz, Harlys Becerra, Laura Baena, Jesús Castejón, Verónika Moral",Spain," September 25, 2019",2019,TV-MA,4 Seasons,"Crime TV Shows, International TV Shows, Spanish-Language TV Shows","Manipulated into embezzling funds for her boyfriend and sentenced to prison, a naïve young woman must quickly learn to survive in a harsh new world."
70185015,TV Show,Portlandia,,"Fred Armisen, Carrie Brownstein",United States," September 25, 2019",2018,TV-14,8 Seasons,TV Comedies,"Fred Armisen and Carrie Brownstein send up the residents of Portland, Ore. Typical targets include artisanal light bulbs and feminist bookstores."
80023289,TV Show,Dark Matter,,"Marc Bendavid, Melissa O'Neil, Anthony Lemke, Alex Mallari Jr., Jodelle Ferland, Roger Cross, Zoie Palmer",Canada," September 25, 2017",2017,TV-14,3 Seasons,"TV Sci-Fi & Fantasy, TV Thrillers","After waking up aboard a derelict spaceship with no memories, the crew of the Raza investigates the mystery of their identities and destination."
70210884,TV Show,American Horror Story,,"Evan Peters, Sarah Paulson, Jessica Lange, Denis O'Hare, Kathy Bates, Angela Bassett, Lily Rabe, Frances Conroy, Cheyenne Jackson, Emma Roberts, Taissa Farmiga, Wes Bentley, Finn Wittrock, Chloë Sevigny, Zachary Quinto, Jamie Brewer, Naomi Grossman, Dylan McDermott, Gabourey Sidibe, Lady Gaga, Mare Winningham, Joseph Fiennes, Michael Chiklis, Matt Bomer, Lizzie Brocheré, Erika Ervin, Mat Fraser, Rose Siggins, Connie Britton, James Cromwell, Adina Porter, Jyoti Amge, Billie Lourde, Alison Pill, Billy Eichner, Leslie Grossman, Colton Haynes, Cuba Gooding Jr., André Holland, Danny Huston",United States," September 24, 2019",2018,TV-MA,8 Seasons,"TV Horror, TV Mysteries, TV Thrillers","This twisted Emmy-winning drama plays upon the power of supernatural fears and everyday horrors, exploring humankind's unsettling capacity for evil."
80127001,TV Show,Resurrection: Ertugrul,,"Engin Altan Düzyatan, Serdar Gökhan, Hülya Darcan, Kaan Taşaner, Esra Bilgiç, Osman Soykut, Serdar Deniz, Cengiz Coşkun, Reshad Strik, Hande Subaşı",Turkey," September 24, 2019",2018,TV-14,5 Seasons,"International TV Shows, TV Action & Adventure, TV Dramas","When a good deed unwittingly endangers his clan, a 13th-century Turkish warrior agrees to fight a sultan's enemies in exchange for new tribal land."
80011539,TV Show,VeggieTales in the House,,"Phil Vischer, Mike Nawrocki, Rob Paulsen, Tress MacNeille",United States," September 23, 2016",2016,TV-Y,4 Seasons,Kids' TV,"Bob the Tomato, Larry the Cucumber and their Veggie pals venture beyond the kitchen counter in these playful adventures with Christian themes."
70197042,TV Show,Person of Interest,,"Jim Caviezel, Michael Emerson, Taraji P. Henson, Kevin Chapman, Sarah Shahi, Amy Acker",United States," September 22, 2016",2016,TV-14,5 Seasons,"Crime TV Shows, TV Action & Adventure, TV Dramas",Ex-CIA agent John Reese and enigmatic billionaire Mr. Finch use software that can predict future events to prevent violent crimes before they occur.
80095697,TV Show,Disenchantment,,"Abbi Jacobson, Eric André, Nat Faxon, John DiMaggio, Tress MacNeille, Matt Berry, David Herman, Maurice LaMarche, Lucy Montgomery, Billy West",United States," September 20, 2019",2019,TV-14,2 Seasons,"TV Action & Adventure, TV Comedies, TV Sci-Fi & Fantasy","Princess duties call, but she'd rather be drinking. Free-spirited Bean exasperates the king as she wreaks havoc with her demon and elf pals."
80190009,TV Show,Fastest Car,,,United States," September 20, 2019",2019,TV-MA,2 Seasons,Reality TV,The drivers of exotic supercars put their street cred on the line against deceptively fast sleeper cars built and modified by true gearheads.
80063740,TV Show,Quantico,,"Priyanka Chopra, Josh Hopkins, Jake McLaughlin, Aunjanue Ellis, Yasmine Al Massri, Johanna Braddy, Tate Ellington, Graham Rogers, Anabelle Acosta, Russell Tovey, Blair Underwood, Pearl Thusi",United States," September 2, 2018",2018,TV-14,3 Seasons,"Crime TV Shows, TV Dramas, TV Mysteries","When evidence in a deadly terrorist attack implicates FBI trainee Alex Parrish, she must discover which one of her classmates framed her."
