81002212,Movie,Bioscope,"Gajendra Ahire, Viju Mane, Girish Mohite, Ravi Jadhav","Nina Kulkarni, Suhas Palshikar, Kushal Badrike, Spruha Joshi, Mangesh Desai, Smita Tambe, Veena Jamkar, Sandeep Khare",India,"August 15, 2018",2015,TV-14,131 min,"Dramas, International Movies, LGBTQ Movies","Inspired by classic and contemporary literature, four renowned Marathi directors create four individual stories in this anthology of short films."
80176707,Movie,For Here or to Go?,Rucha Humnabadkar,"Ali Fazal, Melanie Chandra, Rajit Kapoor, Amitosh Nagpal, Omi Vaidya, Samrat Chakrabarti, Keith Stevenson","United States, India","August 15, 2018",2015,TV-MA,105 min,"Comedies, Dramas, Independent Movies",A software engineer must decide if he'd rather navigate America's frustrating visa renewal process or simply return to his home country of India.
80199381,Movie,Hostiles,Scott Cooper,"Christian Bale, Rosamund Pike, Wes Studi, Jesse Plemons, Timothée Chalamet, Ben Foster, Adam Beach, Rory Cochrane, Peter Mullan, Scott Wilson, Paul Anderson, Jonathan Majors, John Benjamin Hickey, Q'orianka Kilcher, Ryan Bingham",United States,"August 15, 2018",2017,R,134 min,Dramas,"After a long career battling the Cheyenne, a U.S. Army captain is ordered to safely escort the tribe's most influential chief to his Montana homeland."
80202176,Movie,Hurricane Bianca: From Russia With Hate,Matt Kugelman,"Roy Haylock, Rachel Dratch, Brian McCook, D.J. ""Shangela"" Pierce, Doug Plaut, Cheyenne Jackson, Kristen Johnston, Heather McDonald, Wanda Sykes, Janeane Garofalo",United States,"August 15, 2018",2018,TV-MA,85 min,"Comedies, Independent Movies, LGBTQ Movies","When Texas teacher Richard is lured to Russia under false pretenses by his enemy Deb, his drag alter ego Bianca soon turns the country upside down."
81014293,TV Show,Nuestra Lucha Libre,,,,"August 15, 2018",2018,TV-MA,1 Season,"Docuseries, International TV Shows, Spanish-Language TV Shows","This documentary series lifts the mask on Mexican wrestling, diving into the daily lives of its stars, examining the sport’s cultural impact and more."
81014811,TV Show,The Creative Indians,,,,"August 15, 2018",2017,NR,1 Season,"Docuseries, International TV Shows","From chefs and comedians to filmmakers and fashion designers, India’s most notable imaginative minds share their artistic journeys."
70123118,Movie,What's Your Raashee?,Ashutosh Gowariker,"Priyanka Chopra, Harman Baweja, Suzy Brack, Gene Fojtik, Anjan Srivastav, Darshan Jariwala, Dilip Joshi, Daya Shankar Pandey, Yuri Suri, Rajesh Vivek, Geeta Tyagi",India,"August 15, 2018",2009,TV-PG,203 min,"Comedies, International Movies, Music & Musicals","To protect his family from ruin, Yogesh must marry his dream girl in only ten days, so he rushes into dating women with different astrological signs."
80175913,TV Show,20 Minutes,,"Tuba Büyüküstün, Ilker Aksum, Bülent Emin Yarar, İpek Bilgin, Müjde Uzman, Firat Çelik, Ayten Uncuoglu, Cihat Tamer",Turkey,"August 15, 2017",2013,TV-MA,1 Season,"Crime TV Shows, International TV Shows, TV Dramas","When his wife is convicted of murder, a horrified family man races to prove her innocence while a dogged investigator sets out to uncover the truth."
80182274,Movie,Barbecue,Matthew Salleh,,"Australia, Armenia, Japan, Jordan, Mexico, Mongolia, New Zealand, Philippines, South Africa, Sweden, United States, Uruguay","August 15, 2017",2017,TV-MA,101 min,"Documentaries, International Movies","A blend of cultural nuance and mesmerizing techniques adds flavor to this globe-hopping celebration of cooking, tradition and community."
80185166,Movie,Brad Paisley's Comedy Rodeo,Jay Chapman,"Brad Paisley, Nate Bargatze, John Heffron, Jon Reep, Sarah Tiana, Mike E. Winfield",United States,"August 15, 2017",2017,TV-MA,63 min,Stand-Up Comedy,"Country music star Brad Paisley hosts a night of music and laughs with comics Nate Bargatze, John Heffron, Jon Reep, Sarah Tiana and Mike E. Winfield."
80068219,Movie,Colin Quinn: Unconstitutional,Jay Chapman,Colin Quinn,United States,"August 15, 2017",2015,TV-MA,56 min,Stand-Up Comedy,New York comedian Colin Quinn writes and stars in this live one-man stage show that dissects and deconstructs U.S. constitutional history.
70209163,Movie,Goon,Michael Dowse,"Seann William Scott, Jay Baruchel, Liev Schreiber, Alison Pill, Marc-André Grondin, Kim Coates, Eugene Levy, Nicholas Campbell, Richard Clarkin, Jonathan Cherry","United States, Canada","August 15, 2017",2011,R,92 min,"Comedies, Sports Movies","When he's seen dispatching a rude opposing hockey player in the stands, Doug Glatt is hired by a rival team ... for his fighting skills."
80170687,TV Show,Million Yen Women,,"Yojiro Noda, Rila Fukushima, Rena Matsui, Miwako Wagatsuma, Rena Takeda, Yuko Araki, Yuya Endo, Kaito Yoshimura, Moeka Hoshi, Juri Ihata, Mariko Tsutsui, Kanji Furutachi, Tetsuhiro Ikeda, Takashi Yamanaka, Tomoya Nakamura, Lily Franky",Japan,"August 15, 2017",2017,TV-MA,1 Season,"Crime TV Shows, International TV Shows, TV Dramas","Five beautiful but mysterious women move in with unsuccessful novelist Shin, who manages their odd household in exchange for a tidy monthly sum."
80163191,Movie,My Ex-Ex,Nathaniel Warsh,"André Bharti, Katherine Barrell, Ray Galletti, Emily Alatalo, Tamara Duarte, Randal Edwards, Alastair Forbes, Jesse Camacho",Canada,"August 15, 2017",2015,TV-MA,91 min,"Comedies, Romantic Movies",A recently dumped attorney hires a psychic to help her win back her boyfriend. Things take an unexpected turn when another ex re-enters the picture.
80184661,Movie,We're No Animals,Alejandro Agresti,"John Cusack, Paul Hipp, Kevin Morris, Alejandro Agresti, Mario Alarcón, Norman Briski, Lucila Solá, Juana Viale, Pablo Bossi, Leticia Brédice","United States, Argentina","August 15, 2017",2015,TV-MA,94 min,"Comedies, Dramas, Independent Movies","Unhappy with his commercial film work, a jaded Hollywood actor moves to Argentina to participate in an experimental thesis on social philosophy."
80114588,TV Show,Behind Enemy Lines,,,United States,"August 15, 2016",2001,TV-14,1 Season,"British TV Shows, Docuseries","After dire setbacks in 1940, Winston Churchill commissions a new kind of fighting force: commandos trained to use stealth and audacious tactics."
80078761,Movie,Being AP,Anthony Wonke,Tony McCoy,United Kingdom,"August 15, 2016",2015,TV-14,99 min,"Documentaries, International Movies, Sports Movies","With retirement staring him in the face, an all-time-great jump jockey pursues his 20th consecutive title in his unrelenting quest for glory."
80115844,Movie,John & Jane,Ashim Ahluwalia,,India,"August 15, 2016",2005,TV-14,79 min,"Documentaries, International Movies",Truth and fiction blend in this quasi-documentary about six exhausted workers at a Mumbai call center servicing U.S. customers.
80114111,Movie,Louis C.K.: Live at the Comedy Store,Louis C.K.,Louis C.K.,United States,"August 15, 2016",2015,,66 min,Movies,"The comic puts his trademark hilarious/thought-provoking spin on finding a bat in his kitchen, seeing rats having sex, Boston accents and dead pets."
80108998,Movie,Real Crime: Supermarket Heist (Tesco Bomber),,,United Kingdom,"August 15, 2016",2010,TV-14,46 min,Documentaries,"In 2000, U.K. detectives spent months tracking a criminal known only as Sally, who was targeting a supermarket chain with extortion and letter bombs."
70308278,Movie,Mission Blue,"Robert Nixon, Fisher Stevens","James Cameron, Michael deGruy, Sylvia Earle, Bryce Groark, Jeremy Jackson, Carl Safina","United States, Bermuda, Ecuador","August 15, 2014",2014,TV-Y7,94 min,Documentaries,This documentary follows oceanographer Sylvia Earle's campaign to save the world's oceans from threats such as overfishing and toxic waste.
80223113,TV Show,Happy Jail,,,,"August 14, 2019",2019,TV-MA,1 Season,"Crime TV Shows, Docuseries","The Philippine jail known for a viral Michael Jackson dance video comes under the management of an ex-convict, sparking controversy and criticism."
81147274,Movie,Uyare,Manu Ashokan,"Parvathy, Asif Ali, Tovino Thomas, Siddique, Pratap Pothan, Samyuktha Menon, Anarkali Marikar, Prem Prakash",India,"August 14, 2019",2019,TV-14,119 min,"Dramas, International Movies",An aspiring pilot fights for her future – and justice – after surviving an acid attack from her abusive boyfriend.
80136450,TV Show,Exclusive Edition,James Lee,"Berg Lee, Yise Loo, Alvin Wong, Hady, Monday Kang, Ruobing, Wymen Yang, May June, Aenie Wong, Ernest Chong",,"August 14, 2017",2008,TV-14,1 Season,"International TV Shows, TV Dramas","Young journalists working for a magazine juggle careers, romance and other challenges while reporting on social issues and news stories in Malaysia."
80136453,TV Show,Glowing Embers,,"Henley Hii, Debbie Goh, Frederick Lee, Wymen Yang, Melvin Sia, Alvin Wong",,"August 14, 2017",2010,TV-14,1 Season,"International TV Shows, TV Dramas","Amid Malaysia's charcoal industry, a woman deftly adapts to her environs as she juggles three men in her life: her husband, her lover and her friend."
80163530,TV Show,Persona,,"Loo Aye Keng, Kyo, Jojo Goh, Fabian Loo, Emily Chan",,"August 14, 2017",2015,TV-PG,1 Season,"Crime TV Shows, International TV Shows, TV Dramas",A private investigation firm takes on sensitive cases while its uniquely skilled agents deal with issues both inside and out of the office.
80136455,TV Show,The Iron Lady,,"Yeo Yann Yann, Aenie Wong, Seck Fook Yee, Jacky Kam, Frederick Lee, Jeffery Cheng, Mandy Chen",,"August 14, 2017",2009,TV-PG,1 Season,"International TV Shows, TV Dramas","After business troubles destroy her father, a headstrong young woman does battle with her deeply patriarchal culture to secure her family's legacy."
80039439,Movie,The Outcasts,Peter Hutchings,"Victoria Justice, Eden Sher, Ashley Rickards, Claudia Lee, Katie Chang, Peyton List, Jazmyn Richardson, Avan Jogia, Will Peltz",United States,"August 14, 2017",2017,PG-13,94 min,Comedies,"After failing to strike a truce with their school's queen bee, two misfit best friends lead a nerd uprising that turns social hierarchy on its head."
80044804,Movie,Demetri Martin: Live (At the Time),Jay Karas,Demetri Martin,United States,"August 14, 2015",2015,TV-MA,62 min,Stand-Up Comedy,"Demetri Martin brings his off-kilter take on acoustic guitar, hairless cats, color schemes, and the word ""nope"" to Washington in his original special."
81147278,Movie,90 ML,Anita Udeep,"Oviya, Masoom Shankar, Bommu Lakshmi, Monisha Ram, Tej Raj, Shree Gopika, Anson Paul, Devadarshini Chetan",India,"August 13, 2019",2019,TV-14,123 min,"Comedies, International Movies, Music & Musicals",Four friends shake up their lives when they meet a new woman in their apartment complex who encourages them to embrace their wild sides.
81146011,Movie,Calum von Moger: Unbroken,Vlad Yudin,Calum Von Moger,United States,"August 13, 2019",2019,TV-MA,93 min,"Documentaries, Sports Movies","Bodybuilder and two-time Mr. Universe, Calum von Moger, reflects on his rise to fame and battle to come back from a debilitating injury."
81123826,Movie,Hasta los dientes,Alberto Arnaut Estrada,,Mexico,"August 13, 2019",2018,TV-MA,109 min,"Documentaries, International Movies","This documentary follows the controversy surrounding the 2010 murders of two students, who were framed as criminals and killed by the Mexican military."
81002933,TV Show,Tiffany Haddish Presents: They Ready,,"Tracey Ashley, Flame Monroe, Aida Rodriguez, Marlo Williams, April Macie, Chaunté Wayans, Tiffany Haddish",United States,"August 13, 2019",2019,TV-MA,1 Season,"Stand-Up Comedy & Talk Shows, TV Comedies","Hand-picked by Tiffany Haddish, six diverse comedians showcase their raw humor in a series of specials oozing with energy."
81135868,Movie,Woodstock,Barak Goodman,,United States,"August 13, 2019",2019,TV-MA,97 min,"Documentaries, Music & Musicals","For the 50th anniversary of the legendary Woodstock festival, organizers and attendees reminisce about one of the defining moments of the 1960s."
80162142,Movie,Hot Property,Max McGill,"MyAnna Buring, Tom Rhys Harries, Ella Smith, Sam Phillips, Kate Bracken",United Kingdom,"August 13, 2017",2016,TV-MA,82 min,"Comedies, Independent Movies","When a resourceful but flighty Londoner is threatened with eviction, she vows to do whatever it takes to defeat a greedy real estate agent."
80175483,Movie,Mission Control: The Unsung Heroes of Apollo,David Fairhead,,"United States, United Kingdom","August 13, 2017",2017,TV-14,100 min,Documentaries,"Combining archive footage with present-day interviews, this documentary explores how Apollo's mission control helped change the course of history."
80100772,Movie,13 Cameras,Victor Zarcoff,"PJ McCabe, Brianne Moncrief, Sarah Baldwin, Jim Cummings, Heidi Niedermeyer, Neville Archambault",United States,"August 13, 2016",2015,NR,90 min,"Horror Movies, Independent Movies, Thrillers","Young parents-to-be Claire and Ryan move into a suburban rental home, unaware that someone is secretly watching their every move via hidden cameras."
81145135,TV Show,DC Super Hero Girls,,"Grey Griffin, Tara Strong, Nicole Sullivan, Kari Wahlgren, Myrna Velasco, Kimberly Brooks",United States,"August 12, 2019",2019,TV-Y7-FV,1 Season,Kids' TV,"As Metropolis High students, super teens Wonder Woman, Supergirl, Bumblebee, Batgirl, Zatanna, and Green Lantern fight crime, classwork and crushes."
80188580,Movie,Chocolate City: Vegas Strip,Jean-Claude La Marre,"Robert Ri'chard, Darrin Dewitt Henson, Ginuwine, Gilbert Saldivar, Keith Carlos, Michael Bolwaire, Willie Taylor, Michael Jai White, Vivica A. Fox, Mekhi Phifer",United States,"August 12, 2017",2017,TV-MA,90 min,Dramas,"The exotic dancers from Chocolate City get back together for a trip to Las Vegas and a chance at $500,000 in prize money."
80106737,Movie,Los Herederos,Jorge Hernandez Aldana,"Máximo Hollander, Sebastián Aguirre, Úrsula Pruneda, Rodrigo Mendoza, Germán Bracco, Tomás Manterola, Regina Soto, Diego Velázquez, Mónica Del Carmen, José Egüez, Pablo Cruz",Mexico,"August 12, 2017",2015,TV-MA,71 min,"Dramas, International Movies","Spurred by boredom and peer pressure, a group of suburban teens becomes increasingly violent and find their paths intersecting those of their parents."
80142058,Movie,Naked,Michael Tiddes,"Marlon Wayans, Regina Hall, Dennis Haysbert, Loretta Devine, Eliza Coupe, Scott Foley, J.T. Jackson, Brian McKnight, Cory Hardrict, Neil Brown Jr., David Sheridan, Minka Kelly",United States,"August 11, 2017",2017,TV-14,97 min,"Comedies, Romantic Movies","Rob's madly in love and about to be married. Unfortunately, he's also naked, stuck in an elevator and caught in a time loop."
70044256,Movie,Jim Gaffigan: Beyond the Pale,Michael Drumm,Jim Gaffigan,United States,"August 11, 2016",2005,TV-14,72 min,Stand-Up Comedy,"Comedian Jim Gaffigan cuts loose on a variety of topics, including Hot Pockets, holidays, Catholicism and his favorite activity: doing nothing."
70113636,Movie,Jim Gaffigan: King Baby,Troy Miller,Jim Gaffigan,United States,"August 11, 2016",2009,TV-PG,71 min,Stand-Up Comedy,"Jim Gaffigan offers up his take on bacon, bowling and other weighty topics in this stand-up performance filmed live in Austin on his 2008 comedy tour."
70237054,Movie,Jim Gaffigan: Mr. Universe,Jay Karas,Jim Gaffigan,United States,"August 11, 2016",2012,TV-14,77 min,Stand-Up Comedy,"Funnyman Jim Gaffigan offers up his unique take on everything from Disney World to overweight whales in this live show from Washington, D.C."
70301469,Movie,Jim Gaffigan: Obsessed,Jay Chapman,Jim Gaffigan,United States,"August 11, 2016",2014,TV-14,70 min,Stand-Up Comedy,"Comic Jim Gaffigan delivers his sardonic take on topics like eating, exercise, weddings and his five kids in this live stand-up special."
80165437,TV Show,72 Dangerous Animals: Asia,,Bob Brisbane,Australia,"August 10, 2018",2018,TV-14,1 Season,"Docuseries, International TV Shows, Science & Nature TV","From fangs to claws to venomous stings, they all wield deadly weapons. But which creature will be crowned the fiercest of all?"
80188953,TV Show,Afflicted,,,United States,"August 10, 2018",2018,TV-MA,1 Season,"Docuseries, Reality TV",Baffling symptoms. Controversial diagnoses. Costly treatments. Seven people with chronic illnesses search for answers – and relief.
80211884,TV Show,All About the Washingtons,,"Joseph Simmons, Justine Simmons, Kiana Ledé, Nathan Anderson, Leah Rose Randall, Maceo Smedley, Quincy Fouse, DJ Ruckus, Adain Bradley, Tim Meadows, Daymond John, Erick Chavarria, Christopher Clarke, Aubrey Cleland, Arsenio Hall, Stephen Schneider, Max Goudsmit, Noah Gerry, Jamie VanDyke, Ashleigh Hairston",United States,"August 10, 2018",2018,TV-PG,1 Season,TV Comedies,"Hip-hop icon MC Joe Speed retires from showbiz and finds a new rhythm balancing business, romance and everyday family chaos."
81005454,Movie,Beyond the Clouds,Majid Majidi,"Ishaan Khattar, Malavika Mohanan, Goutam Ghose, Sharada, Tannishtha Chatterjee, Shashank Shende, Hema Singh, Akash Gopal","India, Iran","August 10, 2018",2018,TV-14,120 min,"Dramas, Independent Movies, International Movies",A youthful drug dealer in Mumbai must change his ways when the sister who raised him is assaulted by her boss and imprisoned for defending herself.
80995575,Movie,The Birth Reborn,Eduardo Chauvet,,Brazil,"August 10, 2018",2013,TV-14,91 min,"Documentaries, International Movies",Mothers and medical professionals speak about their experiences with the increasingly controversial practice of Caesarean deliveries in Brazil.
80223371,Movie,The Guernsey Literary and Potato Peel Pie Society,Mike Newell,"Lily James, Michiel Huisman, Penelope Wilton, Tom Courtenay, Jessica Brown Findlay, Katherine Parkinson, Matthew Goode","United Kingdom, France, United States","August 10, 2018",2018,TV-14,124 min,"Dramas, Romantic Movies",A London writer bonds with the colorful residents of Guernsey as she learns about the book club they formed during the WWII German occupation.
80175147,Movie,The Package,Jake Szymanski,"Daniel Doheny, Geraldine Viswanathan, Luke Spencer Roberts, Eduardo Franco, Sadie Calvano",United States,"August 10, 2018",2018,TV-MA,95 min,Comedies,"After their buddy suffers an unfortunate accident during spring break, four pals risk everything – including their dignity – to make him whole again."
80239831,Movie,Zion,Floyd Russ,Zion Clark,United States,"August 10, 2018",2018,TV-PG,12 min,"Documentaries, Sports Movies","Born without legs and stuck in foster care for years, teen Zion Clark finds his calling when he pursues competitive wrestling. A documentary short."
80105356,Movie,Alive and Kicking,Susan Glatzer,,"Sweden, United States","August 10, 2017",2016,TV-14,89 min,Documentaries,Take an inside look at swing dancing's continued prosperity and the lively and joyous personalities that make the art form so unique.
70296443,Movie,Demonic,Will Canon,"Maria Bello, Frank Grillo, Cody Horn, Dustin Milligan, Megan Park, Scott Mechlowicz, Aaron Yoo, Alex Goode, Terence Rosemore, Jesse Steccato",United States,"August 10, 2017",2015,R,83 min,"Horror Movies, Independent Movies","When amateur ghost hunters visit an abandoned house, their investigation turns into a massacre, leaving questions for a detective and a psychologist."
80168033,Movie,SHOT! The Psycho-Spiritual Mantra of Rock,Barney Clay,Mick Rock,"United Kingdom, United States","August 10, 2017",2016,TV-MA,98 min,"Documentaries, Music & Musicals",Aptly named iconic rock photographer Mick Rock reconstructs his journey through the thrilling and murky universe of rock 'n' roll history.
80160346,Movie,The Saint,Ernie Barbarash,"Adam Rayner, Eliza Dushku, Ian Ogilvy, James Remar, Roger Moore, Enrique Murciano, Thomas Kretschmann, Beatrice Rosen, Greg Grunberg, Yani Gellman",United States,"August 10, 2017",2017,TV-14,92 min,Action & Adventure,"Master thief Simon Templar – also known as the Saint – is hired by a wealthy banker to find his kidnapped daughter, but not all is as it seems."
70121522,Movie,3 Idiots,Rajkumar Hirani,"Aamir Khan, Kareena Kapoor, Madhavan, Sharman Joshi, Omi Vaidya, Boman Irani, Mona Singh, Javed Jaffrey",India,"August 1, 2019",2009,PG-13,164 min,"Comedies, Dramas, International Movies","While attending one of India's premier colleges, three miserable engineering students and best friends struggle to beat the school's draconian system."
81065784,Movie,Are We Done Yet?,Khaled El Halafawy,"Ahmed Eid, Ayten Amer, Ahmed Fouad Selim, Mohsen Mansour",Egypt,"August 1, 2019",2018,TV-14,87 min,"Comedies, Dramas, International Movies","When authorities arrest his young son, a taxi driver must convince the courts and rabid media that he's not the criminal they seek."
80124099,Movie,Boyka: Undisputed,Todor Chapkanov,"Scott Adkins, Teodora Duhovnikova, Alon Aboutboul, Julian Vergov, Brahim Achabbakhe, Paul Chahidi, Petio Petkov, Valentin Ganev, Vlado Mihailov","Bulgaria, United States","August 1, 2019",2016,R,90 min,Action & Adventure,The fourth film in the action franchise finds Boyka taking on brutal gangsters to protect the widow of a man he unintentionally killed in the ring.
70119812,Movie,Clash of the Titans,Louis Leterrier,"Sam Worthington, Liam Neeson, Ralph Fiennes, Jason Flemyng, Gemma Arterton, Alexa Davalos, Tine Stapelfeldt, Mads Mikkelsen, Luke Evans","United States, United Kingdom, Australia","August 1, 2019",2010,PG-13,106 min,"Action & Adventure, Sci-Fi & Fantasy","If he is to save the life of the beautiful Princess Andromeda, the valiant Perseus must battle a host of powerful, beastly enemies."
60032685,Movie,Darna Mana Hai,Prawal Raman,"Aftab Shivdasani, Antara Mali, Boman Irani, Isha Koppikar, Nana Patekar, Raghuvir Yadav, Rajpal Yadav, Revathy, Saif Ali Khan, Sameera Reddy, Sanjay Kapoor, Shilpa Shetty, Sohail Khan, Vivek Oberoi",India,"August 1, 2019",2003,TV-MA,116 min,"Horror Movies, International Movies, Thrillers","Stranded in a jungle when their car breaks down, six friends pass their time exchanging horror stories, unaware that they may be part of one themselves."
70006816,Movie,Ek Hasina Thi,Sriram Raghavan,"Saif Ali Khan, Urmila Matondkar, Seema Biswas, Pratima Kazmi, Aditya Srivastava, Rasika Joshi, Madan Joshi, Seema Adhikari",India,"August 1, 2019",2004,TV-MA,134 min,"Dramas, International Movies, Thrillers","Imprisoned for underworld crimes she didn’t commit, a vengeful woman breaks free and goes scorched earth on the smooth-talking suitor who framed her."
70236587,Movie,Ferrari Ki Sawaari,Rajesh Mapuskar,"Sharman Joshi, Boman Irani, Ritwik Sahore, Paresh Rawal, Deepak Shirke, Satyadeep Misra, Aakash Dabhade, Nilesh Diwekar, Vidya Balan",India,"August 1, 2019",2012,TV-PG,133 min,"Comedies, International Movies, Sports Movies",A father winds up involved with a stolen Ferrari as he tries to acquire the money to send his son to the leading cricket academy.
520489,Movie,Four Weddings and a Funeral,Mike Newell,"Hugh Grant, Andie MacDowell, James Fleet, Simon Callow, John Hannah, Kristin Scott Thomas, David Bower, Charlotte Coleman, David Haig, Rowan Atkinson, Sophie Thompson, Anna Chancellor, Corin Redgrave",United Kingdom,"August 1, 2019",1994,R,118 min,"Classic Movies, Comedies, International Movies","A commitment-phobic Brit tries to reconnect with an alluring American who's about to make a seemingly awful mistake by marrying a wealthy, boring man."
70266677,Movie,Horns,Alexandre Aja,"Daniel Radcliffe, Juno Temple, Max Minghella, Joe Anderson, Kelli Garner, Heather Graham, David Morse, Kathleen Quinlan, James Remar","United States, Canada","August 1, 2019",2013,R,120 min,"Dramas, Horror Movies, Sci-Fi & Fantasy","Accused of murder, Ig Perish wakes up one day to find he's grown a set of horns – compelling people to confess their sins to him."
60010514,Movie,Jackie Brown,Quentin Tarantino,"Pam Grier, Samuel L. Jackson, Robert Forster, Bridget Fonda, Michael Keaton, Robert De Niro, Michael Bowen, Chris Tucker, LisaGay Hamilton, Tommy 'Tiny' Lister, Hattie Winston, Sid Haig",United States,"August 1, 2019",1997,R,154 min,"Dramas, Thrillers","When an aging flight attendant's caught smuggling cash and forced to help with an investigation, she hatches a clever plan to make off with the dough."
70301367,Movie,Jupiter Ascending,"Lana Wachowski, Lilly Wachowski","Mila Kunis, Channing Tatum, Sean Bean, Eddie Redmayne, Douglas Booth, Tuppence Middleton, Nikki Amuka-Bird, Christina Cole, James D'Arcy, Gugu Mbatha-Raw","United States, Australia","August 1, 2019",2015,PG-13,128 min,"Action & Adventure, Sci-Fi & Fantasy",A young impoverished woman learns she's been predestined to change the fate of the universe after a genetically engineered hunter tracks her down.
81139317,TV Show,Khaani,,"Feroze Khan, Sana Javed, Mehmood Aslam, Saman Ansari, Qavi Khan, Salma Hasan, Rashid Farooqi, Muhammad Mubarik Ali",Pakistan,"August 1, 2019",2017,TV-14,1 Season,"Crime TV Shows, International TV Shows, Romantic TV Shows","After a rich politician's son kills a young woman's brother, an unlikely romantic connection complicates her pursuit of justice."
80014727,Movie,Last Knights,Kazuaki Kiriya,"Clive Owen, Morgan Freeman, Cliff Curtis, Aksel Hennie, Peyman Moaadi, Ayelet Zurer, Shohreh Aghdashloo, Tsuyoshi Ihara, Ahn Sung-kee","United Kingdom, South Korea","August 1, 2019",2015,R,115 min,Action & Adventure,A nobleman who values his people's well-being over his emperor's edicts is killed. His knights vow revenge.
81050688,Movie,Manu,Phanindra Narsetti,"Raja Goutham, Chandini Chowdary, Bomma Sreedhar, John Kottoly, Srikanth Mullagiri, Ravi Teja",India,"August 1, 2019",2018,TV-MA,177 min,"Dramas, Independent Movies, International Movies","The relationship between a painter and his admirer unfolds as an abstract, twist-filled hide-and-seek game against the backdrop of murder and revenge."
