81211681,Movie,Luccas Neto in: Children's Day,Lucas Margutti,"Luccas Neto, Vivian Duarte, Giobanna Alparone, Jéssica Diehl",,"January 1, 2020",2019,TV-Y7,81 min,"Children & Family Movies, Comedies","When Luccas Neto plans a big Children's Day celebration, an unexpected threat at school puts the party – and his friends – at risk."
60000440,Movie,Magnolia,Paul Thomas Anderson,"Jeremy Blackman, Tom Cruise, Melinda Dillon, April Grace, Luis Guzmán, Philip Baker Hall, Philip Seymour Hoffman, Ricky Jay, William H. Macy, Alfred Molina, Julianne Moore, Michael Murphy, John C. Reilly, Jason Robards, Melora Walters",United States,"January 1, 2020",1999,R,189 min,"Dramas, Independent Movies","Through chance, human action, past history and divine intervention, an eclectic cast of characters weaves and warps through each other's lives."
81217437,Movie,Mandi,Shyam Benegal,"Shabana Azmi, Smita Patil, Naseeruddin Shah, Amrish Puri, Kulbhushan Kharbanda, Saeed Jaffrey, Om Puri, Sreela Mazumdar, Neena Gupta",India,"January 1, 2020",1983,TV-MA,155 min,"Dramas, Independent Movies, International Movies","Forbidden love, fraying loyalties and flagrant hypocrisy emerge when sanctimonious politicians drive a madam’s brothel from the heart of Hyderabad."
60000480,Movie,Mansfield Park,Patricia Rozema,"Frances O'Connor, Embeth Davidtz, Jonny Lee Miller, Alessandro Nivola, Harold Pinter, Lindsay Duncan, Sheila Gish, James Purefoy, Victoria Hamilton, Hugh Bonneville",United Kingdom,"January 1, 2020",1999,PG-13,112 min,"Comedies, Dramas, International Movies","A poor heroine is sent to live with wealthy relatives in 1800s England, where her wit and writing talent find the room, and circumstance, to grow."
80117557,TV Show,Messiah,,"Michelle Monaghan, Mehdi Dehbi, John Ortiz, Tomer Sisley, Melinda Page Hamilton, Stefania LaVie Owen, Sayyid El Alami, Jane Adams, Wil Traval, Fares Landoulsi",United States,"January 1, 2020",2020,TV-MA,1 Season,"TV Dramas, TV Thrillers",A wary CIA officer investigates a charismatic man who sparks a spiritual movement and stirs political unrest. A fictional story not based on true events.
70021634,Movie,Monster-in-Law,Robert Luketic,"Jennifer Lopez, Jane Fonda, Michael Vartan, Wanda Sykes, Adam Scott, Monet Mazur, Annie Parisse, Will Arnett, Elaine Stritch, Stephen Dunham","United States, Germany","January 1, 2020",2005,PG-13,101 min,"Comedies, Romantic Movies",An office temp thinks she's found Mr. Right when she starts dating a handsome surgeon. But there's a problem standing in the way of everlasting bliss.
70112500,Movie,Moon,Duncan Jones,"Sam Rockwell, Kevin Spacey, Dominique McElligott, Rosie Shaw, Adrienne Shaw, Kaya Scodelario, Benedict Wong, Matt Berry, Malcolm Stewart, Robin Chalk","United Kingdom, United States","January 1, 2020",2009,R,97 min,"Dramas, Independent Movies, Sci-Fi & Fantasy","As he nears the end of a lonely three-year stint on the moon base Sarang, astronaut Sam Bell begins to hear and see strange things."
786137,Movie,My Girl,Howard Zieff,"Dan Aykroyd, Jamie Lee Curtis, Macaulay Culkin, Anna Chlumsky, Richard Masur, Griffin Dunne, Ann Nelson, Peter Michael Goetz, Jane Hallaren, Anthony R. Jones",United States,"January 1, 2020",1991,PG-13,102 min,Dramas,This coming-of-age charmer follows a summer in the life of an 11-year-old girl who learns about love and loss as she grapples with profound changes.
60034568,Movie,New York Minute,Dennie Gordon,"Mary-Kate Olsen, Ashley Olsen, Eugene Levy, Andy Richter, Riley Smith, Jared Padalecki, Drew Pinsky, Darrell Hammond, Andrea Martin, Alannah Ong, Mary Bond Davis, Bob Saget, Jack Osbourne",United States,"January 1, 2020",2004,PG,91 min,"Children & Family Movies, Comedies","When bickering teenage twins accidentally land in the middle of a criminal operation, they'll have to work together to get themselves out of trouble."
80197991,TV Show,"Nisman: The Prosecutor, the President, and the Spy",Justin Webster,,,"January 1, 2020",2020,TV-MA,1 Season,"Crime TV Shows, Docuseries, International TV Shows","This docuseries details the suspicious death of Alberto Nisman, investigator of the 1994 bombing of the Argentine Israelite Mutual Association building."
70050507,Movie,Pan's Labyrinth,Guillermo del Toro,"Ivana Baquero, Sergi López, Maribel Verdú, Doug Jones, Ariadna Gil, Álex Angulo, Manolo Solo, César Vea, Roger Casamajor, Sergi Lopez","Mexico, Spain","January 1, 2020",2006,R,119 min,"Dramas, International Movies, Sci-Fi & Fantasy",Young Ofelia meets a mythical faun who claims she is destined to become princess of the Underworld. But first she must carry out three perilous tasks.
70125581,Movie,Paranormal Activity,Oren Peli,"Katie Featherston, Randy McDowell, Amber Armstrong, Mark Fredrichs, Micah Sloat, Ashley Palmer, James Piper",United States,"January 1, 2020",2007,R,86 min,"Horror Movies, Thrillers","When Katie and Micah fear their home may be haunted by a demonic presence, Micah sets up a video camera to document all the action."
846071,Movie,Patriot Games,Phillip Noyce,"Harrison Ford, Anne Archer, Patrick Bergin, Sean Bean, Thora Birch, James Fox, Samuel L. Jackson, Polly Walker, J.E. Freeman, James Earl Jones, Richard Harris",United States,"January 1, 2020",1992,R,117 min,Action & Adventure,CIA desk jockey Jack Ryan plunges into the heart of international terrorism after spoiling an assassination attempt on a British royal family member.
81085364,Movie,Pokémon the Movie: Power of Us,Tetsuo Yajima,"Gim Yeong-seon, Ikue Otani, O Inseong, I Sen-ho, Jeong-shin Woo, Sarah Natochenny",,"January 1, 2020",2018,TV-Y7,98 min,"Anime Features, Children & Family Movies","Ash and Pikachu journey to Fula City for its Wind Festival. When disaster looms, they must work together with a group of misfits to save the day!"
81140307,Movie,Posesif,Edwin,"Putri Marino, Adipati Dolken, Gritte Agatha, Chicco Kurniawan, Yayu Unru, Cut Mini Theo, Ismail Basbeth, Maulidina K. Putri",Indonesia,"January 1, 2020",2017,TV-14,102 min,"Dramas, International Movies, Romantic Movies",A student diver risks her scholastic future and relationship with her father when she dates a moody transfer student consumed by their romance.
80188351,TV Show,Reply 1988,,"Lee Hye-ri, Park Bo-gum, Ryu Jun-yeol, Ko Kyoung-pyo, Lee Dong-hwi, Ryu Hye-young, Sung Dong-il, Lee Il-hwa",,"January 1, 2020",2015,TV-14,1 Season,"International TV Shows, Korean TV Shows, Romantic TV Shows",Take a nostalgic trip back to the late 1980s through the lives of five families and their five teenage kids living in a small neighborhood in Seoul.
70128695,Movie,Resident Evil: Afterlife,Paul W.S. Anderson,"Milla Jovovich, Ali Larter, Kim Coates, Shawn Roberts, Sergio Peris-Mencheta, Spencer Locke, Boris Kodjoe, Wentworth Miller","Germany, France, United States, Canada, United Kingdom","January 1, 2020",2010,R,97 min,"Action & Adventure, Horror Movies, Sci-Fi & Fantasy","The Undead Apocalypse continues as super-soldier Alice finds her way to a supposed sanctuary in Los Angeles, which may just be a deadly trap."
80095807,Movie,Riot,John Lyde,"Matthew Reese, Dolph Lundgren, Danielle Chuchran, Chuck Liddell, Michael Flynn, Renny Grames, Eve Mauro, Melanie Stone, Michaela McAllister, Amy Sturdivant",United States,"January 1, 2020",2015,TV-MA,88 min,Action & Adventure,"Seeking vengeance for the murder of his wife, a cop robs a bank in order to be thrown into prison with the Russian kingpin who ruined his life."
70121008,Movie,Road Trip: Beer Pong,Steve Rash,"Nestor Aaron Absera, Julianna Guill, Preston Jones, Julia Levy-Boeken, Danny Pudi, Michael Trotter, Daniel Newman, DJ Qualls",United States,"January 1, 2020",2009,R,97 min,Comedies,"When three college pals hit the road to compete in a big-time beer pong tournament, their trip morphs into an outrageous odyssey."
81167101,TV Show,Save Me,,"Taecyeon, Seo Ye-ji, Cho Seong-ha, Woo Do‑hwan, Son Byung-ho, Kim Kwang-gyoo, Yun Yoo-sun, Park Ji-young, Jeong Hae-gyoon, Jang Hyeok-jin",,"January 1, 2020",2017,TV-14,1 Season,"International TV Shows, Korean TV Shows, TV Dramas",Four young men come to the rescue of a former classmate whose family has been sucked into the clutches of a religious cult and its charismatic leader.
60000870,Movie,Scary Movie,Keenen Ivory Wayans,"Anna Faris, Jon Abrahams, Shannon Elizabeth, Shawn Wayans, Regina Hall, Marlon Wayans, Lochlyn Munro, Cheri Oteri, Carmen Electra, Dave Sheridan, Kurt Fuller, Rick Ducommun, James Van Der Beek, Keenen Ivory Wayans, Marissa Jaret Winokur, Dan Joffre",United States,"January 1, 2020",2000,R,88 min,"Comedies, Horror Movies","The Wayans brothers spoof some of Hollywood's biggest blockbusters, including Scream, I Know What You Did Last Summer, The Matrix and American Pie."
70260512,Movie,Seal Team Six: The Raid on Osama Bin Laden,John Stockwell,"Cam Gigandet, Anson Mount, Freddy Rodríguez, Xzibit, Kathleen Robertson, Robert Knepper, Eddie Kaye Thomas, Kenneth Miller, William Fichtner, Jenny Gabrielle, Mo Gallini",United States,"January 1, 2020",2012,TV-MA,90 min,Action & Adventure,"In this dramatic recreation, U.S. Navy SEAL Team 6 trains for a critical mission, then executes a tough nighttime raid on Osama Bin Laden's compound."
80135276,Movie,Siren,Gregg Bishop,"Chase Williamson, Hannah Fierman, Justin Welborn, Hayes Mercure, Michael Aaron Milligan, Brittany S. Hall, Randy McDowell, Lindsey Garrett, William Mark McCullough, Patrick Wood",United States,"January 1, 2020",2016,TV-MA,83 min,Horror Movies,A groom-to-be and his pals celebrate with a debauched night out that ends with a supernatural assault by a stripper who is not what she appears to be.
60035996,Movie,Sliver,Phillip Noyce,"Sharon Stone, William Baldwin, Tom Berenger, Polly Walker, Colleen Camp, Amanda Foreman, Martin Landau, CCH Pounder, Nina Foch, Keene Curtis",United States,"January 1, 2020",1993,R,107 min,Thrillers,"A divorcée moves into a high-rise with a sordid past and begins a steamy affair with her neighbor, unaware that her every move is being monitored."
60000409,Movie,Snow Day,Chris Koch,"Chris Elliott, Mark Webber, Jean Smart, Schuyler Fisk, Iggy Pop, Pam Grier, John Schneider, Chevy Chase, Zena Grey, Josh Peck",United States,"January 1, 2020",2000,PG,89 min,"Children & Family Movies, Comedies","When a snow day shuts down the whole town, the Wheeler family cuts loose. Hal makes a play for the most popular girl in his school, 10-year-old Natalie takes on the dreaded snowplow man, and Dad gets into a showdown with a rival meteorologist."
80201590,TV Show,Spinning Out,,"Kaya Scodelario, January Jones, Will Kemp, Willow Shields, Evan Roderick, David James Elliott, Sarah Wright Olsen, Svetlana Efremova, Amanda Zhou, Mitchell Edwards, Kaitlyn Leeb, Johnny Weir",,"January 1, 2020",2020,TV-MA,1 Season,TV Dramas,"A figure skating Olympic hopeful struggles to balance love, family and fragile mental health as her dream of winning takes a dizzying hold."
60022396,Movie,Strictly Ballroom,Baz Luhrmann,"Paul Mercurio, Tara Morice, Bill Hunter, Pat Thomson, Gia Carides, Peter Whitford, Barry Otto, John Hannan","Australia, United Kingdom","January 1, 2020",1992,PG,95 min,"Classic Movies, Comedies, Romantic Movies","Dumped by his partner just before a major dance competition, gifted hoofer Scott Hastings is forced to take a graceless neophyte as his new partner."
28631029,Movie,Stuart Little,Rob Minkoff,"Michael J. Fox, Jonathan Lipnicki, Geena Davis, Hugh Laurie, Nathan Lane","Germany, United States","January 1, 2020",1999,PG,85 min,"Children & Family Movies, Comedies",Mr. and Mrs. Little want to adopt a brother for their only child but get more than they bargained for when they take in a mouse with an attitude.
60022058,Movie,Stuart Little 2,Rob Minkoff,"Michael J. Fox, Geena Davis, Hugh Laurie, Jonathan Lipnicki, Nathan Lane, Melanie Griffith, James Woods, Steve Zahn",United States,"January 1, 2020",2002,PG,78 min,"Children & Family Movies, Comedies","Zany misadventures are in store as lovable city mouse Stuart and his human brother, George, raise the roof in this sequel to the 1999 blockbuster."
70077544,Movie,Sweeney Todd: The Demon Barber of Fleet Street,Tim Burton,"Johnny Depp, Helena Bonham Carter, Alan Rickman, Timothy Spall, Sacha Baron Cohen, Jamie Campbell Bower, Laura Michelle Kelly, Jayne Wisener, Ed Sanders","United States, United Kingdom","January 1, 2020",2007,R,116 min,"Dramas, Horror Movies, Music & Musicals","After being falsely imprisoned, a vengeful murderer covers his tracks by enlisting the help of a baker whose meat pies become the toast of London."
60023856,Movie,Teenage Mutant Ninja Turtles II: The Secret of the Ooze,Michael Pressman,"Paige Turco, David Warner, Mark Caso, Michelan Sisti, Leif Tilden, Kenn Scott, Kevin Clash, Ernie Reyes Jr., François Chau, Kevin Nash","United States, Hong Kong","January 1, 2020",1991,PG,88 min,"Children & Family Movies, Comedies","The evil Shredder decides that ooze is what gives the ninja turtles their power, so he obtains some of the toxic junk and creates dangerous mutants."
1029730,Movie,Teenage Mutant Ninja Turtles: The Movie,Steve Barron,"Judith Hoag, Elias Koteas, Josh Pais, Michelan Sisti, Leif Tilden, David Forman, Michael Turney, Jay Patterson, Raymond Serra, James Saito, Kevin Clash",,"January 1, 2020",1990,PG,94 min,"Action & Adventure, Comedies","After exposure to a strange, glowing ooze, four mutant turtles train as ninjas in the sewers and fight crime wherever they find it."
60029154,Movie,Terminator 3: Rise of the Machines,Jonathan Mostow,"Arnold Schwarzenegger, Nick Stahl, Claire Danes, Kristanna Loken, David Andrews, Mark Famiglietti, Earl Boen, Moira Sinise, Chopper Bernet, Christopher Lawford","United States, Germany, United Kingdom","January 1, 2020",2003,R,109 min,"Action & Adventure, Sci-Fi & Fantasy","Ten years after John Connor saved Earth from Judgment Day, he encounters T-X, a robotic assassin ordered to finish what T-1000 started."
70103524,Movie,Terminator Salvation,McG,"Christian Bale, Sam Worthington, Moon Bloodgood, Helena Bonham Carter, Anton Yelchin, Jadagrace, Bryce Dallas Howard, Common, Jane Alexander, Michael Ironside","United States, Germany, United Kingdom, Italy","January 1, 2020",2009,PG-13,115 min,"Action & Adventure, Sci-Fi & Fantasy","All grown up in post-apocalyptic 2018, John Connor must lead the resistance of humans against increasingly dominating militaristic robots."
70021631,Movie,The Amityville Horror,Andrew Douglas,"Ryan Reynolds, Melissa George, Chloë Grace Moretz, Jesse James, Jimmy Bennett, Rachel Nichols, Philip Baker Hall, Isabel Conner, Brendan Donaldson, Annabel Armour",United States,"January 1, 2020",2005,R,89 min,Horror Movies,"This hair-raising remake of the 1979 horror hit depicts the ordeal of the Lutz family, whose new home has a gory past and a legacy of demons."
81012487,TV Show,The Bride of Habaek,,"Shin Sae-kyeong, Nam Joo-hyuk, Lim Ju-hwan, Krystal Jung, Gong Myoung, Lee Gyoung-young, Yang Dong-geun",,"January 1, 2020",2017,TV-14,1 Season,"International TV Shows, Korean TV Shows, Romantic TV Shows","When a quest for divine stones in the human world goes awry, the water god Habaek seeks help from a psychiatrist predestined to serve him."
81044551,TV Show,The Circle,,Michelle Buteau,,"January 1, 2020",2020,TV-MA,1 Season,Reality TV,"Status and strategy collide in this social experiment and competition show where online players flirt, befriend and catfish their way toward $100,000."
404067,Movie,The Craft,Andrew Fleming,"Robin Tunney, Fairuza Balk, Neve Campbell, Rachel True, Skeet Ulrich, Christine Taylor, Breckin Meyer, Nathaniel Marston, Cliff De Young, Assumpta Serna",United States,"January 1, 2020",1996,R,101 min,"Horror Movies, Thrillers","At a Catholic school, a new girl falls in with a clique of teen witches who wield their powers against anyone who crosses them, even their parents."
70020296,Movie,The Crying Game,Neil Jordan,"Stephen Rea, Miranda Richardson, Forest Whitaker, Jaye Davidson, Adrian Dunbar, Breffini McKenna, Joe Savino, Birdie Sweeney, Andree Bernard, Jim Broadbent","United Kingdom, Japan, United States","January 1, 2020",1992,R,112 min,"Classic Movies, Independent Movies, Thrillers","IRA terrorist Fergus bonds with his prisoner, Jody. Jody tells Fergus of his girlfriend, Dil, with whom Fergus later falls in love."
70021652,Movie,The Dukes of Hazzard,Jay Chandrasekhar,"Johnny Knoxville, Seann William Scott, Jessica Simpson, Burt Reynolds, M.C. Gainey, David Koechner, Kevin Heffernan, James Roday, Michael Roof, Joe Don Baker",United States,"January 1, 2020",2005,PG-13,104 min,"Action & Adventure, Comedies","The Duke boys are back in this comedy based on the TV series, following Bo and Luke as they tear around Hazzard County in their trusty Dodge Charger."
70061763,Movie,The Dukes of Hazzard: The Beginning,Robert Berlinger,"Randy Wayne, Jonathan Bennett, Joel David Moore, Willie Nelson, April Scott, Harland Williams, Christopher McDonald, Hal Williams, Sherilyn Fenn, Gary Cole",United States,"January 1, 2020",2007,R,95 min,"Action & Adventure, Comedies","The mischievous Duke boys, Bo and Luke, are sent to live with their Uncle Jesse and cousin Daisy in this prequel movie to the popular TV series."
70113006,Movie,The Final Destination,David R. Ellis,"Bobby Campo, Shantel VanSanten, Nick Zano, Haley Webb, Mykelti Williamson, Krista Allen, Andrew Fiscella, Justin Welborn, Stephanie Honoré",United States,"January 1, 2020",2009,R,82 min,Horror Movies,"Nick O'Bannon thinks he's cheated death when he keeps a grisly premonition from becoming reality, but he soon realizes that fate has other plans."
70105370,Movie,The Invention of Lying,"Ricky Gervais, Matthew Robinson","Ricky Gervais, Jennifer Garner, Jonah Hill, Louis C.K., Jeffrey Tambor, Fionnula Flanagan, Rob Lowe, Tina Fey, Donna Sorbello, Stephanie March",United States,"January 1, 2020",2009,PG-13,99 min,"Comedies, Romantic Movies","In a world where no one fibs, a screenwriter gains fame and fortune – and maybe the girl of his dreams – by saying things that aren't true."
60004484,Movie,The Lord of the Rings: The Return of the King,Peter Jackson,"Elijah Wood, Ian McKellen, Liv Tyler, Viggo Mortensen, Sean Astin, Cate Blanchett, John Rhys-Davies, Bernard Hill, Billy Boyd, Dominic Monaghan, Orlando Bloom, Hugo Weaving","New Zealand, United States","January 1, 2020",2003,PG-13,201 min,"Action & Adventure, Sci-Fi & Fantasy","Aragorn is revealed as the heir to the ancient kings as he, Gandalf and the other members of the broken fellowship struggle to save Gondor."
60004483,Movie,The Lord of the Rings: The Two Towers,Peter Jackson,"Elijah Wood, Ian McKellen, Liv Tyler, Viggo Mortensen, Sean Astin, Cate Blanchett, John Rhys-Davies, Bernard Hill, Christopher Lee, Billy Boyd, Dominic Monaghan, Orlando Bloom","New Zealand, United States","January 1, 2020",2002,PG-13,179 min,"Action & Adventure, Sci-Fi & Fantasy","Frodo and Sam head to Mordor to destroy the One Ring of Power while Gimli, Legolas and Aragorn search for the orc-captured Merry and Pippin."
5670479,Movie,The Mask of Zorro,Martin Campbell,"Antonio Banderas, Anthony Hopkins, Catherine Zeta-Jones, Stuart Wilson, Matt Letscher, Tony Amendola, Pedro Armendáriz Jr., William Marquez, José Pérez, Victor Rivers","United States, Germany, Mexico","January 1, 2020",1998,PG-13,138 min,"Action & Adventure, Romantic Movies","An aging Zorro passes the torch to a young successor, schooling him in discipline and training him to take up the sword against crooked officials."
60001808,Movie,The Naked Gun 2 1/2: The Smell of Fear,David Zucker,"Leslie Nielsen, Priscilla Presley, George Kennedy, O.J. Simpson, Robert Goulet, Richard Griffiths, Jacqueline Brookes",,"January 1, 2020",1991,PG-13,85 min,Comedies,"Bumbling cop Frank Drebin is out to foil the big boys in the energy industry, who intend to suppress technology that would put them out of business."
60001807,Movie,The Naked Gun: From the Files of Police Squad!,David Zucker,"Leslie Nielsen, Priscilla Presley, Ricardo Montalban, George Kennedy, O.J. Simpson, Susan Beaubian, Nancy Marchand, Raye Birk",United States,"January 1, 2020",1988,PG-13,85 min,"Comedies, Cult Movies","In this slapstick comedy classic, hapless cop Frank Drebin causes more problems than he solves while trying to stop a plot to kill Queen Elizabeth II."
793907,Movie,The Natural,Barry Levinson,"Robert Redford, Robert Duvall, Glenn Close, Kim Basinger, Wilford Brimley, Barbara Hershey, Robert Prosky, Richard Farnsworth, Joe Don Baker, John Finnegan",United States,"January 1, 2020",1984,PG,138 min,"Classic Movies, Dramas, Sports Movies",A gifted baseball player whose life has taken some startling turns becomes a 35-year-old rookie who helps a cellar-dwelling team get back in the game.
60001854,Movie,The Original Kings of Comedy,Spike Lee,"Steve Harvey, D.L. Hughley, Cedric the Entertainer, Bernie Mac",United States,"January 1, 2020",2000,R,111 min,Stand-Up Comedy,"Director Spike Lee documents the last night of the hit comedy tour featuring comics Steve Harvey, Cedric the Entertainer, D.L. Hughley and Bernie Mac."
20159719,Movie,The Peacemaker,Mimi Leder,"George Clooney, Nicole Kidman, Marcel Iures, Aleksandr Baluev, Rene Medvesek, Gary Werntz, Randall Batinkoff, Jim Haynie, Alexander Strobele, Holt McCallany",United States,"January 1, 2020",1997,R,124 min,Action & Adventure,"After terrorists trigger a nuclear blast in Russia, a U.S. Special Forces intelligence agent and a nuclear weapons expert come to the rescue."
60024914,Movie,The Ring,Gore Verbinski,"Naomi Watts, Martin Henderson, David Dorfman, Brian Cox, Jane Alexander, Lindsay Frost, Amber Tamblyn, Rachael Bella, Daveigh Chase, Shannon Cochran",United States,"January 1, 2020",2002,PG-13,116 min,"Horror Movies, Thrillers",A reporter watches a video that supposedly sets in motion the viewer's death in seven days. Can she unravel the mystery before her own time is up?
60000209,Movie,The Talented Mr. Ripley,Anthony Minghella,"Matt Damon, Gwyneth Paltrow, Jude Law, Cate Blanchett, Philip Seymour Hoffman, Jack Davenport, James Rebhorn, Sergio Rubini, Philip Baker Hall, Celia Weston",United States,"January 1, 2020",1999,R,139 min,"Dramas, Thrillers","A charming sociopath maneuvers into the lush life of a young heir. But as he embraces the posh lifestyle, he'll stop at nothing to hold onto it."
60033108,Movie,Tremors,Ron Underwood,"Kevin Bacon, Fred Ward, Finn Carter, Michael Gross, Reba McEntire, Robert Jayne, Charlotte Stewart, Tony Genaro, Ariana Richards, Richard Marcus, Victor Wong, Bibi Besch",United States,"January 1, 2020",1990,PG-13,96 min,"Comedies, Cult Movies, Horror Movies","After a seismologist gets unusual readings on her equipment, handymen discover 30-foot-long carnivorous worms that suck their prey underground."
1064058,Movie,Tremors 2: Aftershocks,S.S. Wilson,"Fred Ward, Chris Gartin, Helen Shaver, Michael Gross, Marcelo Tubert, Marco Hernandez, José Ramón Rosario, Thomas Rosales Jr.",,"January 1, 2020",1995,PG-13,100 min,"Comedies, Horror Movies, Sci-Fi & Fantasy",A rag-tag team of survivalists and scientists battle supersucking desert creatures that are worming their way through the oil fields of Mexico.
60021377,Movie,Tremors 3: Back to Perfection,Brent Maddock,"Michael Gross, Shawn Christian, Susan Chuang, Charlotte Stewart, Ariana Richards, Tony Genaro, Barry Livingston, John Pappas, Jason Hopkins",United States,"January 1, 2020",2001,PG,104 min,"Comedies, Horror Movies, Sci-Fi & Fantasy","When a theme park's simulated giant worm attacks turn real, Burt Gummer and two young entrepreneurs team up to battle the flesh-eating graboids."
60033107,Movie,Tremors 4: The Legend Begins,S.S. Wilson,"Michael Gross, Sara Botsford, Billy Drago, Brent Roam, August Schellenberg, J.E. Freeman, Ming Lo, Lydia Look, Sam Ly, Neil Kopit",United States,"January 1, 2020",2004,PG-13,101 min,"Comedies, Horror Movies, Sci-Fi & Fantasy","Residents of a abandoned mining town attempt to get to the bottom of a series of recent, mysterious deaths before their own fates are sealed."
80066084,Movie,Tremors 5:  Bloodline,Don Michael Paul,"Michael Gross, Jamie Kennedy, Ernest Ndhlovu, Lawrence Joffe, Zak Hendrikz, Natalie Becker, Emmanuel Castis, Brandon Auret, Daniel Janks","South Africa, United States","January 1, 2020",2015,PG-13,99 min,"Comedies, Horror Movies, Sci-Fi & Fantasy","When he is hired to capture a deadly creature terrorizing South Africa, survivalist Burt Gummer brings along a new tech-savvy partner."
1067876,Movie,True Grit,Henry Hathaway,"John Wayne, Glen Campbell, Kim Darby, Jeremy Slate, Robert Duvall, Dennis Hopper, Alfred Ryder, Strother Martin, Jeff Corey",United States,"January 1, 2020",1969,G,128 min,"Classic Movies, Dramas",Teenage tomboy Mattie Ross enlists the help of crusty lawman Rooster Cogburn to track down the hired hand who murdered her father.
70117902,Movie,Up in the Air,Jason Reitman,"George Clooney, Vera Farmiga, Anna Kendrick, Jason Bateman, Amy Morton, Melanie Lynskey, J.K. Simmons, Sam Elliott, Danny McBride, Zach Galifianakis, Chris Lowell",United States,"January 1, 2020",2009,R,110 min,"Comedies, Dramas, Romantic Movies","Ryan Bingham flies around the country firing employees on behalf of companies, but he faces losing the job he savors to recent college grad Natalie."
60001396,Movie,What Lies Beneath,Robert Zemeckis,"Harrison Ford, Michelle Pfeiffer, Diana Scarwid, Joe Morton, James Remar, Miranda Otto, Wendy Crewson, Ray Baker, Micole Mercurio, Amber Valletta, Sloane Shelton",United States,"January 1, 2020",2000,PG-13,130 min,"Horror Movies, Thrillers","When Claire Spencer starts hearing ghostly voices and seeing spooky images, her husband tries to reassure her by telling her it's all in her head."
